text_id_shuff,num_sentences_shuff,last_sentence_shuff,ppl_shuff
22,5,"The model predicted that this patient is likely to have diabetes, and this conclusion is shaped most strongly by the patient’s notably high plasma glucose concentration, which stands far above what is typical and is widely recognized as a primary indicator of diabetes risk.",8.65
23,1,"The model also considered the patient’s history of multiple pregnancies and their insulin level, but the absence of elevated insulin—despite being lower than average—did not signal a heightened risk in this context.",46.06
23,2,"This low glucose value strongly steered the prediction away from diabetes, as high blood sugar is a hallmark of the condition and its absence is a reassuring sign.",28.15
23,3,"Although the patient is older than average and has a higher BMI, both of which can increase diabetes risk, these factors were not enough to outweigh the protective effect of their low glucose.",16.61
23,4,"Altogether, the combination of these features, especially the very low glucose, led the model to conclude that this patient is unlikely to have diabetes, highlighting how a single strong indicator can sometimes override other moderate risk factors.",12.97
23,5,"For this patient, the model predicted that they are not likely to have diabetes, and the story begins with their notably low glucose level, which stands out as much lower than what is typically seen in the dataset.",12.15
24,1,"While the patient’s BMI is slightly below average, which can sometimes signal a lower risk, their skinfold thickness is a bit higher than typical, but not enough to outweigh the protective effects of the other features.",23.96
24,2,"This low glucose reading, often a key indicator of diabetes risk, set the stage for the model’s confidence in a negative prediction.",23.37
24,3,"Adding to this, the patient’s young age further reduced the likelihood, as diabetes risk tends to rise with age and this individual is notably younger than the average patient in the dataset.",14.7
24,4,"Finally, although the patient has experienced more pregnancies than average—a factor that can increase risk—the overall combination of lower glucose, youth, and moderate BMI led the model to conclude that diabetes is unlikely in this case.",12.18
24,5,"The model predicted that this patient is not likely to have diabetes, and this outcome is shaped most strongly by their relatively low glucose level, which is well below what is typically seen in diabetic cases.",11.5
25,1,"Although the patient’s BMI is close to the average and could be a concern if considered alone, its effect is outweighed by the protective influence of the other features.",28.44
25,2,"The next most influential factor is their glucose level, which, while slightly below the average, does not reach the higher values that often signal elevated risk, thus reinforcing the model’s confidence in a negative prediction.",19.77
25,3,"The patient’s family history of diabetes, as measured by the diabetes pedigree function, is also much lower than typical, suggesting a reduced inherited risk and further supporting the model’s assessment.",13.43
25,4,"Finally, the number of pregnancies is somewhat below average, and in the context of the other factors, this detail does little to shift the model’s prediction away from a low diabetes risk, illustrating how the interplay of age, glucose, and family history collectively drive the outcome.",11.32
25,5,"For this patient, the model predicted that they are not likely to have diabetes, and this outcome is shaped most strongly by their relatively young age of 21, which is notably lower than the average age in the dataset and generally associated with a lower risk of developing diabetes.",9.9
26,1,"The patient’s young age adds to this protective effect, since diabetes risk tends to rise with age, and their single pregnancy and moderate insulin level do not provide strong counterarguments in this context.",43.82
26,2,"Because glucose is a primary indicator of diabetes risk, this low value immediately steers the prediction away from a diabetes diagnosis.",32.57
26,3,"Supporting this, the patient’s body mass index is also much lower than average, which further reduces the likelihood of diabetes, as higher BMI is often associated with increased risk.",17.53
26,4,"Altogether, these factors combine to create a profile that the model interprets as low risk, with the especially low glucose and BMI values playing the most decisive roles in the final prediction.",14.19
26,5,"The model predicted that this patient is not likely to have diabetes, and this outcome is shaped most strongly by their low plasma glucose level, which stands out as significantly below the typical average for the dataset.",12.79
27,1,"Additionally, the diabetes pedigree function, which reflects a strong family history of diabetes, is much higher than average, suggesting a significant genetic predisposition that the model recognizes as a contributing factor.",27.55
27,2,"Building on this, the patient’s age is also notably higher than average, and since the risk of developing diabetes increases with age, this further nudges the prediction toward a positive diagnosis.",14.05
27,3,"The patient’s body mass index is higher than what is commonly observed, and since excess body weight is closely linked to insulin resistance, this adds another layer of risk.",10.0
27,4,"Finally, the patient’s insulin level is more than double the average, and while high insulin can sometimes indicate the body’s attempt to compensate for insulin resistance, in the context of the other risk factors, it reinforces the model’s assessment that this patient is at high risk for diabetes.",7.22
27,5,"The model predicted that this patient is likely to have diabetes, and this conclusion is shaped most strongly by the patient’s elevated plasma glucose level, which stands out well above the typical average and is a well-known indicator of diabetes risk.",7.73
28,1,"Their BMI is nearly identical to the average, so it did not sway the prediction much, and while their insulin level is higher than typical, the model considered this in the context of the other features, especially the protective effect of youth.",32.61
28,2,"Although their glucose level is slightly above average, the model weighed age more heavily, recognizing that younger individuals are less likely to develop diabetes even with modestly elevated glucose.",18.23
28,3,"The fact that the patient has had no pregnancies also contributed to the lower risk, as a higher number of pregnancies can sometimes be associated with increased diabetes risk, particularly gestational diabetes.",13.97
28,4,"Altogether, the combination of these factors led the model to conclude that, despite a few elevated clinical measures, this patient’s overall profile does not indicate a high likelihood of diabetes.",10.97
28,5,"For this patient, the model predicted that they are not likely to have diabetes, and this decision was shaped most strongly by their relatively young age of 22, which generally lowers diabetes risk compared to the older average in the dataset.",10.66
29,1,"The diabetes pedigree function, which reflects family history and genetic predisposition, is also much higher than average for this patient, suggesting a strong inherited risk that further tips the scales toward a positive prediction.",30.8
29,2,"First, the patient’s age stands out as a significant contributor, as being 44 years old places them well above the average age in the dataset, and advancing age is widely recognized as a risk factor for diabetes due to cumulative metabolic changes over time.",15.6
29,3,"In addition, the patient’s BMI is notably elevated at 33.8, which signals obesity—a condition closely linked to insulin resistance and increased diabetes risk.",11.41
29,4,"While the patient’s glucose level is only slightly above average and they have had no pregnancies (which, in this context, slightly lowers risk), these factors were less influential compared to the combined impact of age, BMI, and family history, ultimately leading the model to predict diabetes for this individual.",9.91
29,5,"The model predicted that this patient is likely to have diabetes, and several key factors shaped this outcome.",9.95
