text_id_shuff,num_sentences_shuff,last_sentence_shuff,ppl_shuff
0,1,"The diabetes pedigree function, which reflects family history and genetic predisposition, is also higher than typical, further tipping the scales toward a positive prediction.",41.21
0,2,"Because advancing age is a well-established risk factor for diabetes, the model interprets the patient’s age of 53 as a key driver, especially when considered alongside a notably elevated glucose level of 145, which signals impaired blood sugar regulation.",19.58
0,3,"While the patient’s BMI is close to the average, the model still weighs it as a contributing factor, since a BMI in the 30s is generally associated with increased diabetes risk, particularly when combined with other warning signs.",11.73
0,4,"Finally, the patient’s insulin level is more than double the average, suggesting possible insulin resistance, and when all these factors converge, the model finds compelling evidence to predict diabetes for this individual.",10.61
0,5,"The model predicted that this patient is likely to have diabetes, and this conclusion is shaped most strongly by the patient’s age, which stands out as significantly higher than the average in the dataset.",10.17
1,1,"Their body mass index is close to the typical value for this group, so it neither strongly increases nor decreases the risk in this context.",33.52
1,2,"Because the patient’s glucose level is well below the average seen in the dataset, it actively pulls the prediction away from a diabetes diagnosis, reflecting the well-established link between high blood sugar and diabetes.",24.52
1,3,"Although the patient is slightly older than the average in the dataset, age alone does not outweigh the protective effect of their glucose level, especially when considered alongside their insulin value, which is only modestly above average and does not signal a strong risk.",14.75
1,4,"Finally, the patient’s skin thickness is a bit lower than average, which, when combined with the other features, further supports the model’s conclusion that this individual is not predicted to have diabetes.",10.78
1,5,"The model predicted that this patient is not likely to have diabetes, and this outcome is shaped most strongly by their relatively low plasma glucose concentration, which is a key indicator in diabetes risk assessment.",9.96
2,1,"Although the patient’s body mass index is slightly below the average, which could have contributed a small protective effect, the model also considered the patient’s family history of diabetes—reflected in a higher-than-average diabetes pedigree function—which nudged the risk upward but was not enough to outweigh the other factors.",24.47
2,2,"Since glucose is a key indicator of diabetes risk, the fact that this patient’s glucose value is well below the typical average signaled to the model that their immediate risk is low.",18.74
2,3,"This impression was reinforced by the patient’s young age, which further reduced the likelihood of diabetes, as younger individuals are generally less susceptible to the condition.",14.05
2,4,"Finally, the patient’s number of pregnancies was lower than average, and in the context of the other features, this did little to increase their risk, leading the model to its overall conclusion.",11.84
2,5,"For this patient, the model predicted that they are not likely to have diabetes, and this decision was shaped most strongly by their relatively low plasma glucose level.",11.44
3,1,"Although the patient’s BMI is higher than average, which could have increased their risk, its influence is outweighed by the much stronger signals from glucose and age.",33.79
3,2,"Because glucose is a primary indicator of diabetes, this lower value immediately steers the prediction away from a diabetes diagnosis.",23.87
3,3,"The patient’s young age further reinforces this direction, as younger individuals are statistically less likely to develop diabetes, especially when other risk factors are not pronounced.",14.21
3,4,"Additionally, both the patient’s insulin level and family history of diabetes (as measured by the diabetes pedigree function) are lower than average, which together provide further reassurance to the model that this patient is at low risk, highlighting how a combination of protective factors can counterbalance a single elevated risk factor.",11.53
3,5,"The model predicted that this patient is not likely to have diabetes, and this outcome is shaped most strongly by their relatively low plasma glucose level, which is well below the typical average seen in people at risk.",11.69
4,1,"The patient’s glucose level, while above average at 125, contributed moderately, as higher blood sugar readings are a direct indicator of impaired glucose regulation, a hallmark of diabetes.",51.6
4,2,"Closely following, the patient’s relatively young age of 28 actually worked against the prediction, since younger individuals are generally at lower risk, but this protective effect was outweighed by other factors.",21.42
4,3,"The Diabetes Pedigree Function, which measures genetic predisposition, was notably high at 0.962, suggesting a strong family history of diabetes and further tipping the scales toward a positive prediction.",14.8
4,4,"Finally, the fact that the patient has had only one pregnancy, compared to the average, slightly reduced the risk, but this effect was minor in the context of the other, more influential features; together, these factors led the model to conclude that the patient is at high risk for diabetes.",10.87
4,5,"The model predicted that this patient is likely to have diabetes, and this decision was shaped most strongly by the patient’s elevated Body Mass Index (BMI) of 33.3, which stands out as higher than the average and is widely recognized as a significant risk factor for diabetes due to its association with insulin resistance.",9.27
5,1,"With only one pregnancy, the patient falls below the typical number seen in the dataset, which may further reduce risk, as higher numbers of pregnancies can sometimes be associated with increased diabetes risk in certain populations.",38.3
5,2,"Although the patient’s BMI is notably higher than average, which could have raised concern, the model appears to weigh age more heavily, recognizing that youth often provides a protective effect against diabetes onset.",23.75
5,3,"The patient’s glucose level is somewhat elevated, but not dramatically so, and in the context of their age and other health indicators, this does not tip the balance toward a diabetes prediction.",15.28
5,4,"Finally, the absence of measurable insulin could be interpreted in several ways, but when considered alongside the other features, it does not outweigh the protective factors, leading the model to its final, reassuring prediction.",13.07
5,5,"The model predicted that the patient is not likely to have diabetes, and this outcome is shaped most strongly by the patient’s young age of 21, which generally signals a lower risk compared to older individuals.",11.91
6,1,"The patient’s advanced age further intensifies the risk, as the likelihood of developing diabetes increases with age, especially when combined with other risk factors.",14.39
6,2,"This high glucose reading acts as a primary signal, since persistently raised blood sugar is a hallmark of diabetes and often triggers further investigation.",19.61
6,3,"Compounding this, the patient’s body mass index is also notably higher than average, and since excess body weight is a well-established risk factor for diabetes, it amplifies the model’s concern.",12.64
6,4,"Although the patient’s family history and blood pressure are closer to average and play a smaller role, the combination of high glucose, elevated BMI, and older age creates a compelling case for the model’s prediction.",10.6
6,5,"The model predicted that this patient is likely to have diabetes, and this conclusion is shaped most strongly by the patient’s elevated glucose level, which stands out well above the typical value seen in the dataset.",10.23
7,1,"The model also took into account the patient’s diabetes pedigree function—a measure of family history—which was notably lower than average, suggesting a reduced inherited risk.",44.84
7,2,"This reassuring signal is further supported by the patient’s young age of 25, since younger individuals are statistically less likely to develop diabetes compared to older adults.",21.15
7,3,"Although the patient’s body mass index is somewhat elevated at 32.7, which could have nudged the risk higher, its influence was outweighed by the much more decisive effects of glucose and age.",16.77
7,4,"Finally, the patient’s insulin level, while slightly below the average, did not raise any significant concerns in the context of the other features, leading the model to confidently predict a low likelihood of diabetes for this individual.",12.04
7,5,"For this patient, the model predicted that they are not likely to have diabetes, and this decision was shaped most strongly by their relatively low plasma glucose level of 87, which stands out as well below the typical average and is widely recognized as a key indicator of lower diabetes risk.",11.2
8,1,"The patient’s younger age also played a role, as diabetes risk tends to rise with age, so being younger than most patients in the dataset further reduced the likelihood.",27.23
8,2,"Since glucose levels are a primary indicator of diabetes risk, the fact that this patient’s glucose value is well below the typical average provided a strong signal against a diabetes diagnosis.",16.01
8,3,"Although their body mass index is notably higher than average—a factor that can increase risk—the model weighed this against the much lower glucose, ultimately tipping the balance toward a negative prediction.",14.49
8,4,"While the number of pregnancies and skin thickness were somewhat elevated, these factors did not outweigh the protective effect of low glucose and younger age, leading the model to conclude that this patient is not predicted to have diabetes.",11.83
8,5,"For this patient, the model predicted that they are not likely to have diabetes, and this decision was shaped most strongly by their relatively low plasma glucose concentration.",11.26
9,1,"The patient’s family history of diabetes, as measured by the diabetes pedigree function, is also much lower than average, further diminishing the likelihood of diabetes, while a relatively low number of pregnancies and a moderate blood pressure reading provide additional reassurance.",24.09
9,2,"Most notably, the patient’s Body Mass Index (BMI) is considerably lower than the average in the dataset, which likely signals a reduced risk, as higher BMI is often associated with increased diabetes susceptibility.",14.96
9,3,"Although the patient’s glucose level is somewhat elevated compared to the typical value, this single factor was not enough to outweigh the protective influence of other features.",12.58
9,4,"Altogether, these factors interact to tip the balance toward a prediction of no diabetes, with the model weighing the patient’s lower BMI and limited family history most heavily in its decision.",11.39
9,5,"The model predicted that this patient is not likely to have diabetes, and this outcome is shaped by several key aspects of their health profile.",11.05
10,1,"The patient’s BMI is slightly above average, and since higher body mass is closely linked to insulin resistance, this likely nudged the prediction toward diabetes.",35.53
10,2,"The patient’s age stands out as a significant factor, as being 42 years old places them well above the average in the dataset, and advancing age is widely recognized to increase diabetes risk due to cumulative metabolic changes over time.",16.8
10,3,"Interestingly, their glucose level is actually lower than the average, which would typically reduce risk, but in this case, it was outweighed by other factors.",11.65
10,4,"Additionally, the patient’s unusually high number of pregnancies and lower-than-average blood pressure may have contributed in more subtle ways, with the former possibly reflecting a history of gestational diabetes and the latter interacting with other risk factors, ultimately tipping the balance toward a positive diabetes prediction.",9.87
10,5,"The model predicted that this patient is likely to have diabetes, and this conclusion emerges from a combination of their clinical and demographic characteristics.",9.61
11,1,"The patient’s BMI and insulin levels both hovered at or above average, with the insulin value being particularly high, and these features together reinforced the model’s assessment, as excess body weight and elevated insulin are often linked to impaired glucose regulation.",35.22
11,2,"High glucose is a well-known indicator of diabetes risk, so this finding immediately set the stage for a higher predicted risk.",25.74
11,3,"Interestingly, the patient’s diabetes pedigree function—a measure of family history—was much lower than average, which would normally suggest a reduced risk, but this effect was outweighed by the other factors.",16.61
11,4,"Although the patient’s blood pressure was slightly below average, this alone was not enough to counterbalance the strong signals from glucose and insulin, leading the model to its final prediction of diabetes.",12.35
11,5,"The model predicted that the patient is likely to have diabetes, and this decision was shaped most strongly by the patient’s elevated glucose level, which stands out well above the typical value seen in the dataset.",11.67
12,1,"Interestingly, while the patient’s glucose level was only moderately above average, it did not weigh as heavily in the final decision, perhaps because the other risk factors were more pronounced.",21.48
12,2,"At the forefront, the patient’s Body Mass Index (BMI) stands out as notably higher than average, which is significant because elevated BMI is widely recognized as a strong risk factor for diabetes due to its association with insulin resistance.",11.16
12,3,"Closely following, the Diabetes Pedigree Function—a measure reflecting family history and genetic predisposition—was also much higher than typical, suggesting a heightened inherited risk that further nudged the prediction toward diabetes.",11.19
12,4,"Finally, the patient’s relatively young age and lower number of pregnancies compared to the average might have slightly counterbalanced the risk, but these factors were ultimately outweighed by the strong influence of BMI and family history, leading the model to its conclusion.",9.36
12,5,"The model predicted that this patient is likely to have diabetes, and several key factors shaped this outcome.",9.47
13,1,"Additionally, the patient’s BMI is slightly above average, and a higher BMI is widely recognized as a risk factor for diabetes due to its association with insulin resistance.",13.33
13,2,"Although the patient’s glucose level is actually lower than average, which would typically reduce diabetes risk, other features outweighed this protective effect.",14.12
13,3,"The patient’s age stands out as a significant contributor, as being 38 years old—older than the average in the dataset—raises the risk, reflecting the well-established link between age and diabetes onset.",11.6
13,4,"Most notably, the patient’s unusually high number of pregnancies, far exceeding the typical count, may have further increased risk, since multiple pregnancies can impact long-term metabolic health, and even though blood pressure is only slightly elevated, it adds a subtle but reinforcing signal to the overall risk profile, tipping the balance toward a positive diabetes prediction.",11.86
13,5,"The model predicted that this patient is likely to have diabetes, and this decision was shaped by a combination of clinical and demographic factors.",10.92
14,1,"What tipped the scales further was the patient’s high body mass index (BMI), which is considerably above average and is recognized in medical research as a major contributor to diabetes risk, especially when combined with advancing age.",19.09
14,2,"Although the patient’s glucose level is actually lower than the typical value seen in the dataset, which might have argued against a diabetes diagnosis, this effect was outweighed by other factors.",15.88
14,3,"The patient’s family history of diabetes, as measured by the diabetes pedigree function, is lower than average, which could have reduced the risk, but again, this was not enough to counterbalance the other signals.",11.27
14,4,"Finally, the unusually high number of pregnancies added another layer of risk, as multiple pregnancies can increase the likelihood of developing diabetes, particularly in women with other risk factors, leading the model to its final prediction.",10.27
14,5,"The model predicted that this patient is likely to have diabetes, and this decision was shaped most strongly by the patient’s age, which stands out as notably higher than average and is a well-known risk factor for diabetes as people grow older.",9.63
15,1,"Additionally, the diabetes pedigree function—a measure reflecting family history and genetic predisposition—is quite low at 0.149, indicating minimal inherited risk.",49.38
15,2,"Closely following, the patient’s glucose level of 100 is also below the average, suggesting that their blood sugar regulation is within a healthy range, further lowering the likelihood of diabetes.",19.45
15,3,"The patient’s relatively young age of 28 adds to this protective profile, as younger individuals are statistically less prone to developing diabetes compared to older adults.",12.86
15,4,"Finally, the patient’s insulin level, while slightly below average, does not raise concern in the context of the other reassuring features, collectively leading the model to its confident prediction that this patient does not have diabetes.",11.21
15,5,"The model predicted that the patient is not likely to have diabetes, and this outcome is shaped most strongly by the patient’s notably low Body Mass Index (BMI) of 19.5, which stands out as much lower than what is typically seen in the dataset and is generally associated with a reduced risk for diabetes.",9.74
16,1,"Although the patient has experienced seven pregnancies—a factor that can sometimes raise diabetes risk due to gestational diabetes—this effect is outweighed by the other, more influential features.",45.17
16,2,"Next, the patient’s glucose level, while slightly elevated at 105, remains below the average for this dataset, further lowering the likelihood of diabetes since high blood sugar is a key risk factor.",24.07
16,3,"The patient’s young age of 24 also plays a protective role, as diabetes risk tends to increase with age, and this individual is notably younger than most others in the dataset.",14.07
16,4,"Finally, the diabetes pedigree function, which reflects family history, is lower than average, suggesting less inherited risk and reinforcing the model’s conclusion that this patient is not predicted to have diabetes.",11.99
16,5,"The model predicted that this patient is not likely to have diabetes, and this outcome is shaped most strongly by the patient’s Body Mass Index (BMI), which is recorded as 0.0—far below what is typical and suggesting either an error or a value that signals extremely low body fat, both of which would reduce diabetes risk in the model’s eyes.",11.56
17,1,"Interestingly, the patient’s glucose level is almost identical to the average, so it did not push the prediction in either direction, and the relatively low diabetes pedigree function suggests a lower inherited risk, which may have slightly counteracted the overall risk.",29.24
17,2,"At 38 years old, the patient is somewhat older than the average in the dataset, and this higher age increases risk, as diabetes becomes more common with advancing years due to cumulative metabolic changes.",17.48
17,3,"The patient’s BMI stands out as particularly high at 39.4, well above the average, and this level of obesity is a well-known driver of diabetes risk, likely tipping the balance toward a positive prediction.",12.3
17,4,"However, despite a blood pressure reading that is only moderately elevated, the combined effect of age and especially high BMI outweighed these other factors, leading the model to predict diabetes for this patient.",11.18
17,5,"The model predicted that this patient is likely to have diabetes, and this decision was shaped most strongly by the patient’s age and body mass index (BMI).",10.31
18,1,"The patient’s diabetes pedigree function, reflecting family history, is lower than average and would typically reduce risk, but in this case, it is not enough to counterbalance the impact of the high glucose and BMI.",38.62
18,2,"Compounding this, the patient’s body mass index is notably high, suggesting a greater likelihood of insulin resistance, a common pathway leading to diabetes.",21.0
18,3,"Although the patient is relatively young compared to others in the dataset, which might usually lower the risk, this protective effect is outweighed by the other concerning indicators.",17.06
18,4,"Finally, the unusually thick skin fold measurement further hints at increased body fat, reinforcing the model’s prediction that this patient is at heightened risk for diabetes.",15.18
18,5,"The model predicted that this patient is likely to have diabetes, and this conclusion is shaped most strongly by the patient’s elevated glucose level, which stands out well above the typical average and signals a key risk factor for diabetes.",13.52
19,1,"The model also considered the patient’s family history of diabetes, as indicated by a higher diabetes pedigree function, and their above-average skin thickness, both of which could have nudged the risk upward.",37.32
19,2,"Alongside this, the patient’s glucose level is also on the lower side at 96, which further reduces the likelihood of diabetes, since elevated glucose is a hallmark of the condition.",20.12
19,3,"Although the patient is somewhat older than the average in the dataset, age alone does not outweigh the protective effects of their BMI and glucose levels.",16.34
19,4,"However, these latter factors were not strong enough to counterbalance the reassuring signals from BMI and glucose, leading the model to its final, reassuring prediction.",15.35
19,5,"The model predicted that this patient is not likely to have diabetes, and this outcome is shaped most strongly by their relatively low Body Mass Index (BMI) of 24.7, which stands out as notably below the average for this dataset and suggests a lower risk profile.",12.34
20,1,"Additionally, the absence of any pregnancies, compared to the average, subtly decreases risk, especially since gestational diabetes can be a precursor to type 2 diabetes in women.",35.05
20,2,"Following this, the patient’s glucose level, while not exceptionally low, remains beneath the average, further reducing the likelihood of diabetes since elevated glucose is a key indicator of the disease.",24.36
20,3,"The patient’s relatively young age of 27 also plays a protective role, as diabetes risk tends to rise with age, making youth a significant mitigating factor.",16.28
20,4,"Although the patient’s diabetes pedigree function is slightly above average, indicating some family history of diabetes, its influence is outweighed by the other factors, leading the model to conclude that this patient is not predicted to have diabetes.",12.71
20,5,"The model predicted that this patient is not likely to have diabetes, and this outcome is shaped most strongly by their notably low Body Mass Index (BMI) of 18.4, which stands well below the typical average and suggests a lower risk, as higher BMI is often associated with increased diabetes susceptibility.",10.87
21,1,"Additionally, the patient’s diabetes pedigree function—a measure of family history—was lower than typical, further reducing the predicted risk.",62.65
21,2,"Since glucose is a key indicator of diabetes risk, the fact that their value is well below the average helped steer the prediction away from diabetes, even though other factors were at play.",27.38
21,3,"While the patient’s BMI is higher than average, which could have increased their risk, the model weighed this against their young age, which generally lowers the likelihood of developing diabetes at this stage of life.",15.55
21,4,"Finally, the absence of pregnancies, which can sometimes be associated with gestational diabetes, did not contribute to an increased risk in this case, allowing the model to confidently predict that the patient does not have diabetes.",10.58
21,5,"For this patient, the model predicted that they are not likely to have diabetes, and this decision was shaped most strongly by their relatively low plasma glucose level.",10.59
22,1,"The diabetes pedigree function, which reflects a strong family history of diabetes, adds another layer of risk, indicating a genetic predisposition that can make the patient more susceptible even in the presence of other risk factors.",16.78
22,2,"Building on this, the patient’s body mass index is also significantly elevated, suggesting a level of obesity that is known to increase insulin resistance and, consequently, the likelihood of developing diabetes.",10.82
22,3,"Age further amplifies this risk, as the patient is considerably older than the average in the dataset, and advancing age is associated with a natural decline in metabolic efficiency and increased vulnerability to chronic conditions like diabetes.",8.89
22,4,"Finally, the patient’s high insulin level, while less influential than the other features, may signal the body’s struggle to regulate blood sugar effectively, reinforcing the model’s prediction that this patient is at high risk for diabetes.",8.15
