text_id_shuff,num_sentences_shuff,last_sentence_shuff,ppl_shuff
22,3,"The model also takes into account that the individual is recorded as Black, which, in this context, slightly decreases the risk prediction, though the reason for this effect may be complex and intertwined with other variables.",12.29
22,4,"However, this effect is partially offset by the individual’s age of 23, which slightly reduces the predicted risk, perhaps reflecting the model’s recognition that younger individuals may have more opportunities for rehabilitation.",9.69
22,5,"Altogether, these factors interact to shape the model’s final assessment, with the prior criminal record exerting the strongest upward influence, while age, recidivism history, and demographic information collectively temper the overall risk estimate.",9.22
22,6,"In estimating the likelihood that this individual will be rearrested within two years, the model first considers the number of prior crimes committed.",9.04
22,7,"Finally, the three months spent in jail marginally increases the risk, as time served can sometimes be associated with higher recidivism rates.",9.12
23,1,"Additionally, the individual is not recorded as Black, which the model interprets as a small increase in risk, reflecting the influence of demographic variables in its assessment.",53.97
23,2,"Although the individual has no prior crimes, this absence slightly increases the risk, suggesting that the model interprets a clean record as a modest risk factor, perhaps due to other interacting variables.",26.7
23,3,"The fact that the individual has previously recidivated, however, counteracts this by lowering the risk, indicating that the model weighs past recidivism as a mitigating factor in this particular case.",15.74
23,4,"Finally, having spent no time in jail nudges the risk upward, as the model appears to associate a lack of jail time with a slightly higher chance of reoffending.",12.11
23,5,"In estimating the likelihood that this individual will be rearrested within two years, the model first considers their age of 20, which actively reduces the predicted risk, as younger individuals are generally associated with a lower probability of recidivism in this context.",10.17
23,6,"Altogether, these factors interact to shape the model’s prediction, with age and prior recidivism exerting the strongest downward pressure on the estimated risk, while the absence of prior crimes, demographic information, and jail history subtly elevate it.",9.15
24,1,"As the narrative unfolds, the relatively brief period—just one month—spent in jail further nudges the prediction downward, indicating that limited incarceration may be associated with a reduced propensity to reoffend.",44.51
24,2,"To begin with, the absence of prior criminal offenses exerts the most substantial downward influence on the predicted risk, signaling that a clean record strongly suggests a lower chance of recidivism.",21.92
24,3,"Furthermore, the fact that the individual is not recorded as Black and has not previously recidivated each contribute additional reductions to the risk, reflecting the model’s sensitivity to demographic and behavioral patterns observed in the data.",18.17
24,4,"Finally, the presence of a misdemeanor charge, rather than a more serious offense, slightly decreases the estimated risk.",14.8
24,5,"In estimating the likelihood that this individual will be rearrested within two years, the model primarily draws upon several key aspects of their history and current circumstances.",13.35
24,6,"Taken together, these factors interact to shape a prediction that the individual’s likelihood of recidivism is notably lower, with each feature actively steering the model’s assessment toward a more optimistic outlook.",12.26
25,1,"To begin with, the person's age of 25 subtly reduces the predicted risk, as younger individuals are generally considered less likely to reoffend according to the model's learned patterns.",37.57
25,2,"Interestingly, despite the individual having a history of recidivism, this prior behavior actually decreases the predicted risk in this case, suggesting that the model interprets repeated recidivism in the context of other features, perhaps viewing it as less indicative of future risk when combined with the current profile.",14.4
25,3,"Additionally, the presence of five prior crimes also acts to lower the risk, which may indicate that the model recognizes a plateau effect, where accumulating prior offenses does not linearly escalate future risk.",12.06
25,4,"Furthermore, the fact that the individual is not recorded as Black slightly increases the risk, reflecting the model's sensitivity to demographic factors, though this effect is modest.",10.73
25,5,"Taken together, these factors interact to shape the model's overall assessment, with each feature exerting its influence in a nuanced interplay that ultimately determines the predicted risk of recidivism.",9.64
25,6,"In estimating the likelihood that this individual will be rearrested within two years, the model carefully weighs several aspects of their background.",9.52
25,7,"Finally, the brief duration of just one month spent in jail nudges the risk upward, as shorter incarceration periods might be associated with less severe offenses or insufficient time for rehabilitation.",9.43
26,1,"To begin with, the fact that the individual has no prior criminal offenses exerts a strong downward influence on the predicted risk, signaling to the model that a clean record substantially reduces the chance of recidivism.",21.27
26,2,"However, the individual’s relatively young age of 24 slightly counteracts these protective factors, as the model recognizes that younger individuals statistically face a higher risk of reoffending.",12.83
26,3,"Additionally, the model notes that the individual is not recorded as Black, which, in the context of the data, modestly increases the predicted risk.",10.5
26,4,"This effect is further reinforced by the absence of any previous recidivism, which again nudges the prediction lower, suggesting a pattern of law-abiding behavior.",10.14
26,5,"Taken together, these factors interact to shape the model’s overall prediction, with the absence of prior crimes and recidivism serving as the most influential forces in lowering the estimated risk.",8.96
26,6,"In estimating the likelihood that this individual will be rearrested within two years, the model primarily draws upon several key aspects of their history and background.",8.62
26,7,"Finally, the two months spent in jail contribute a small upward adjustment, reflecting the model’s assessment that even brief incarceration can marginally elevate the likelihood of future offenses.",8.88
27,1,"At the outset, the fact that the individual has committed one prior crime exerts the strongest upward influence on the predicted risk, substantially increasing the model’s confidence that recidivism may occur.",29.67
27,2,"Additionally, the model notes that the individual is not recorded as Black, which modestly raises the risk estimate, reflecting the model’s learned associations from the data.",22.08
27,3,"Meanwhile, the 16 months the individual has spent in jail acts to lower the predicted risk, indicating that extended incarceration may be associated with a reduced likelihood of reoffending.",14.25
27,4,"However, this effect is partially counterbalanced by the individual’s previous experience with recidivism; having already recidivated appears to slightly reduce the predicted risk, suggesting that the model interprets this history as a moderating factor, perhaps due to patterns observed in similar cases.",11.7
27,5,"Taken together, these factors interact to shape the model’s overall prediction, with the number of prior crimes pushing the risk upward, while prior recidivism, time spent in jail, and age collectively temper this effect.",10.36
27,6,"In estimating the likelihood that this individual will be rearrested within two years, the model primarily draws upon several key aspects of their history and background.",10.08
27,7,"Finally, the individual’s age—26 years—also contributes to a slight decrease in risk, as the model tends to associate younger ages with higher recidivism rates.",9.3
28,1,"Because this person has a history of seven prior offenses, the model substantially lowers its prediction of recidivism risk, suggesting that a higher count of past crimes is associated with a reduced chance of being rearrested in this context.",23.45
28,2,"The individual’s age, being 29, also contributes to a modest reduction in risk, as the model associates this age with a slightly lower probability of rearrest.",14.93
28,3,"On the other hand, the model notes that the current charge is a misdemeanor, which slightly increases the predicted risk, indicating that misdemeanors may be linked to a higher chance of recidivism compared to more serious charges.",9.02
28,4,"Additionally, the fact that the individual has previously recidivated further decreases the predicted risk, reinforcing the model’s tendency to view repeated recidivism as less likely after a certain threshold.",8.16
28,5,"Taken together, these factors interact to shape the model’s overall assessment, with the history of prior crimes and previous recidivism exerting the most significant downward influence on the estimated risk of rearrest.",7.26
28,6,"In estimating the likelihood that this individual will be rearrested within two years, the model primarily considers the number of prior crimes committed.",6.94
28,7,"Finally, the model observes that the individual is not recorded as Black, which results in a small increase in the predicted risk.",6.99
29,1,"Because the individual has committed 12 prior crimes, this factor substantially reduces the predicted risk, suggesting that a higher count of past offenses paradoxically signals a lower chance of recidivism in this context.",43.55
29,2,"The model also takes into account the individual’s recorded race, and being identified as Black contributes a modest reduction to the predicted risk.",27.49
29,3,"On the other hand, having spent no time in jail slightly increases the risk, indicating that lack of recent incarceration may be associated with a higher chance of reoffending.",15.97
29,4,"Furthermore, the fact that the individual has previously recidivated also slightly decreases the risk, reinforcing the influence of criminal history on the model’s assessment.",13.27
29,5,"Altogether, these factors interact to shape the model’s prediction, with the individual’s extensive criminal history and prior recidivism exerting the most significant downward pressure on the estimated risk of rearrest.",10.32
29,6,"In estimating the likelihood that this individual will be rearrested within two years, the model primarily considers their history of prior offenses.",9.51
29,7,"Finally, the individual’s age of 29 marginally lowers the risk, as younger age groups are often considered at higher risk.",9.65
