text_id,num_sentences,last_sentence,ppl
0,1,"In evaluating the likelihood that this patient has diabetes, the model first considers the patient's age of 53, which exerts the most significant influence by increasing the predicted risk.",26.41
0,2,"Building on this, the patient's elevated plasma glucose concentration of 145 further amplifies the probability, as higher glucose levels are closely associated with diabetes onset.",20.18
0,3,"The patient's body mass index of 30.30, indicative of obesity, also contributes to the risk, albeit to a lesser extent, by reflecting a known risk factor for diabetes.",11.35
0,4,"Additionally, the diabetes pedigree function value of 0.77 suggests a notable familial predisposition, subtly reinforcing the model's prediction.",11.58
0,5,"Finally, the patient's 2-hour serum insulin level of 165 provides further, though smaller, evidence supporting the likelihood of diabetes.",10.89
0,6,"Collectively, these factors interact to drive the model's assessment toward a higher probability that the patient has diabetes.",9.83
1,1,"In evaluating whether the patient has diabetes, the model primarily considered the patient's plasma glucose concentration.",44.02
1,2,"Because the glucose level was relatively low, this factor exerted a strong downward influence on the likelihood of diabetes, substantially reducing the predicted risk.",19.13
1,3,"Although the patient's age and body mass index contributed modestly to increasing the probability, their effects were not sufficient to counterbalance the impact of the low glucose value.",10.3
1,4,"Meanwhile, both the insulin level and triceps skin fold thickness slightly decreased the risk, but their influence was minor compared to the dominant effect of glucose.",9.19
1,5,"Altogether, the interplay of these features led the model to predict a lower chance of diabetes for this patient, with the low glucose concentration serving as the pivotal reason for this outcome.",8.27
2,1,"In evaluating whether this patient has diabetes, the model primarily considered several key health indicators.",130.88
2,2,"To begin with, the patient's plasma glucose concentration is relatively low, which actively reduces the likelihood of diabetes in this case.",27.7
2,3,"This effect is further reinforced by the patient's young age, as younger individuals are generally at a lower risk for developing diabetes.",12.73
2,4,"Additionally, the patient's body mass index, while moderately elevated, still contributes to lowering the predicted risk.",10.4
2,5,"Although the patient's family history, as reflected by the diabetes pedigree function, slightly increases the probability of diabetes, this influence is not strong enough to outweigh the protective effects of the other factors.",8.82
2,6,"Finally, the number of pregnancies exerts a minimal downward influence on the risk.",9.19
2,7,"Taken together, these factors interact to produce a prediction that the patient is less likely to have diabetes, with the low glucose level and young age serving as the most influential protective mechanisms.",8.29
3,1,"In evaluating whether the patient has diabetes, the model carefully weighs several key factors.",73.36
3,2,"At the outset, the patient's relatively low plasma glucose concentration acts as a strong protective influence, substantially reducing the likelihood of a diabetes diagnosis.",22.16
3,3,"This effect is further reinforced by the patient's young age, which also diminishes the risk.",13.02
3,4,"As the analysis progresses, the model notes that the patient's elevated Body Mass Index exerts a modest upward pressure on the probability of diabetes, signaling a potential concern.",10.91
3,5,"However, this is counterbalanced by the patient's lower serum insulin levels and a low diabetes pedigree function, both of which gently nudge the prediction downward.",10.99
3,6,"Taken together, these interacting factors culminate in a prediction that leans away from a diabetes diagnosis, primarily due to the combined mitigating effects of low glucose levels and youth, despite the presence of a higher BMI.",9.3
5,1,"In evaluating whether the patient has diabetes, the model first considers the patient's age of 21, which actively reduces the likelihood of diabetes, as younger individuals are generally at lower risk.",24.46
5,2,"However, this protective effect is partially offset by the patient's elevated BMI of 35.80, which exerts upward pressure on the prediction, reflecting the well-established link between higher body mass and increased diabetes risk.",11.66
5,3,"Meanwhile, the patient's plasma glucose concentration of 124 slightly decreases the probability, suggesting that this glucose level does not strongly indicate diabetes in this context.",10.73
5,4,"The fact that the patient has experienced only one pregnancy also subtly lowers the risk, as higher numbers of pregnancies can sometimes be associated with greater susceptibility.",10.32
5,5,"Finally, the absence of measurable insulin levels nudges the prediction upward, albeit modestly, hinting at a potential concern.",9.94
5,6,"Altogether, these factors interact to shape the model's final assessment, with age and glucose acting as mitigating influences, while BMI and insulin absence counterbalance them to some extent.",9.29
6,1,"In evaluating whether the patient has diabetes, the model first considered the patient's plasma glucose concentration, which stood out as a significant factor.",33.08
6,2,"The notably high glucose level actively pushed the prediction toward a positive diabetes diagnosis, exerting the strongest influence among all features.",25.42
6,3,"Building on this, the patient's elevated Body Mass Index further reinforced the likelihood of diabetes, amplifying the model's confidence in its prediction.",15.06
6,4,"The patient's advanced age also contributed meaningfully, as older individuals are generally at greater risk for diabetes, thereby nudging the prediction higher.",11.81
6,5,"While the diabetes pedigree function added a modest upward influence, suggesting some hereditary risk, its effect was less pronounced.",12.77
6,6,"Interestingly, the patient's diastolic blood pressure slightly counteracted these risks, but its negative contribution was minimal compared to the dominant effects of glucose, BMI, and age.",10.42
6,7,"Altogether, these factors combined to drive the model's prediction toward a higher probability that the patient has diabetes.",9.28
7,1,"In evaluating whether the patient has diabetes, the model primarily considered the patient's plasma glucose concentration.",44.02
7,2,"Because the glucose level was relatively low, this exerted a strong downward influence on the likelihood of diabetes.",20.43
7,3,"This effect was further reinforced by the patient's young age, which also contributed to lowering the predicted risk.",12.56
7,4,"Although the patient's body mass index was somewhat elevated, nudging the prediction slightly upward, this was not enough to outweigh the protective effects of the other factors.",9.41
7,5,"Additionally, a low diabetes pedigree function and moderate insulin levels both played minor roles in reducing the probability of diabetes.",10.54
7,6,"Taken together, these factors combined to decrease the model's overall prediction that the patient has diabetes, with the low glucose level and young age serving as the most influential causes.",9.42
8,1,"In evaluating whether the patient has diabetes, the model first considered the patient's plasma glucose concentration, which was measured at 95.",28.83
8,2,"This relatively moderate glucose level actively reduced the likelihood of a diabetes diagnosis, exerting the strongest downward influence on the prediction.",25.62
8,3,"However, this effect was partially counterbalanced by the patient's elevated Body Mass Index of 37.70, which nudged the prediction upward, signaling that higher body weight increases diabetes risk.",16.1
8,4,"Meanwhile, the patient's age of 27 contributed to a lower risk, as younger individuals are generally less susceptible to diabetes, and this factor further decreased the model's estimate.",11.64
8,5,"The number of pregnancies, recorded at five, played a smaller but still positive role, slightly increasing the predicted risk, since more pregnancies can be associated with higher diabetes susceptibility.",10.62
8,6,"Finally, the triceps skin fold thickness, measured at 33 mm, had a minor positive effect, subtly raising the prediction.",9.62
8,7,"Altogether, the model synthesized these interacting factors—balancing the protective effects of lower glucose and younger age against the risk-enhancing influences of higher BMI, more pregnancies, and greater skin thickness—to arrive at its final assessment.",8.48
9,1,"In evaluating whether the patient has diabetes, the model carefully weighed several health indicators.",111.35
9,2,"At the outset, the patient's Body Mass Index (BMI) emerged as a significant factor, and its relatively moderate value actively reduced the likelihood of diabetes.",27.68
9,3,"Meanwhile, the patient's plasma glucose concentration, although somewhat elevated, exerted a mild upward influence on the risk, nudging the prediction slightly higher.",16.84
9,4,"As the model continued its assessment, it considered the diabetes pedigree function, which, given its low value, further diminished the probability of diabetes.",12.96
9,5,"The number of pregnancies and the diastolic blood pressure, both within typical ranges, contributed only marginally to lowering the risk.",11.29
9,6,"Altogether, these interacting factors combined to shape the model's final prediction, with the mitigating effects of BMI and family history outweighing the modest risk introduced by glucose levels.",10.2
10,1,"In evaluating whether the patient is likely to have diabetes, the model first considers the patient's age of 42, which exerts a notable upward influence on the prediction, suggesting that advancing age increases the risk.",23.65
10,2,"However, this effect is partially counteracted by the patient's plasma glucose concentration of 106, which actively reduces the likelihood of diabetes in this case.",13.81
10,3,"Meanwhile, the patient's body mass index of 31.20 contributes positively, indicating that a higher BMI nudges the prediction toward a greater risk.",10.66
10,4,"Additionally, the fact that the patient has experienced nine pregnancies further amplifies the model's estimate, albeit to a lesser extent.",9.39
10,5,"Finally, the diastolic blood pressure of 52 exerts only a minor positive effect.",9.04
10,6,"Taken together, these factors interact to shape the model's overall assessment, with age and BMI pushing the prediction higher, while glucose levels provide a moderating influence, ultimately guiding the model toward its final decision.",8.46
13,1,"In evaluating whether the patient has diabetes, the model first considered the patient's plasma glucose concentration, which stood at 104.",37.93
13,2,"This relatively moderate glucose level exerted a slight downward pull on the likelihood of diabetes, thereby reducing the overall risk.",23.72
13,3,"However, the patient's age of 38 subtly counteracted this effect, as advancing age tends to elevate diabetes risk, nudging the prediction upward.",14.4
13,4,"Simultaneously, the patient's body mass index of 31.20, indicative of obesity, further amplified the probability, since higher BMI is closely linked to increased diabetes susceptibility.",9.87
13,5,"Adding to this, the fact that the patient has experienced 13 pregnancies contributed modestly to the risk, reflecting the established association between multiple pregnancies and diabetes.",8.73
13,6,"Finally, the diastolic blood pressure of 72 had a negligible impact, barely influencing the model's decision.",8.21
13,7,"Altogether, these factors interacted to shape the model's prediction, with the mitigating effect of glucose being partially offset by age, BMI, and pregnancy history, ultimately guiding the assessment of the patient's diabetes risk.",7.36
14,1,"In evaluating whether the patient has diabetes, the model first considered the patient's age of 45, which moderately increased the likelihood of a positive prediction, suggesting that advancing age plays a significant role in elevating diabetes risk.",26.19
14,2,"However, this effect was nearly counterbalanced by the patient's plasma glucose concentration of 106, which actively reduced the predicted risk, indicating that their glucose level is not alarmingly high.",16.5
14,3,"Additionally, the patient's low diabetes pedigree function of 0.18 further diminished the probability, reflecting a limited genetic predisposition.",13.61
14,4,"Despite these mitigating factors, the patient's elevated BMI of 36.60 contributed to a higher risk, as excess body weight is a well-known driver of diabetes.",10.27
14,5,"Finally, the model noted the patient's history of 13 pregnancies, which slightly nudged the prediction upward, recognizing that multiple pregnancies can incrementally increase diabetes susceptibility.",9.29
14,6,"Altogether, these interacting factors shaped the model's nuanced assessment of the patient's diabetes risk.",8.73
15,1,"In this case, the model predicts a lower likelihood of diabetes for the patient, and this outcome emerges from the interplay of several key health indicators.",24.14
15,2,"To begin with, the patient's Body Mass Index (BMI) stands at 19.50, which actively contributes to reducing the predicted risk, as lower BMI values are generally associated with a decreased probability of diabetes.",10.17
15,3,"Furthermore, the patient's plasma glucose concentration is measured at 100, and this relatively modest glucose level further diminishes the model's estimation of diabetes risk.",8.21
15,4,"As the narrative unfolds, the patient's age—28 years—also plays a role, albeit to a lesser extent, by slightly lowering the risk, since younger individuals are statistically less likely to develop diabetes.",7.47
15,5,"Additionally, the Diabetes Pedigree Function, which reflects genetic predisposition, is low at 0.15, subtly nudging the prediction downward.",7.17
15,6,"Finally, the patient's insulin level, recorded at 46, exerts a minor but still negative influence on the risk assessment.",6.75
15,7,"Taken together, these factors interact to guide the model toward its conclusion: the patient is less likely to have diabetes, primarily due to favorable values in BMI and glucose, with further support from age, family history, and insulin levels.",6.2
16,1,"In this case, the model predicts a lower likelihood of diabetes for the patient, and this outcome emerges from the interplay of several key factors.",22.2
16,2,"To begin with, the patient's Body Mass Index (BMI) exerts the most substantial downward influence on the prediction, as a relatively low BMI actively reduces the estimated risk.",12.73
16,3,"This effect is further reinforced by the patient's plasma glucose concentration, which, being only moderately elevated, also contributes to lowering the probability of diabetes.",9.23
16,4,"Additionally, the patient's young age further diminishes the risk, as younger individuals are generally less susceptible to developing diabetes.",7.25
16,5,"Although the patient has experienced a higher number of pregnancies, which slightly nudges the prediction upward, this effect is relatively minor compared to the protective influence of the other features.",7.0
16,6,"Finally, the diabetes pedigree function, reflecting family history, exerts a small negative effect, subtly decreasing the risk.",7.08
16,7,"Altogether, these factors combine to guide the model toward a prediction that the patient is less likely to have diabetes.",6.53
17,1,"In evaluating whether the patient has diabetes, the model first considers the patient's age of 38, which moderately increases the likelihood of diabetes, as older age is often associated with higher risk.",18.73
17,2,"Building on this, the patient's elevated BMI of 39.40 further amplifies the risk, since higher body mass index is a well-established contributor to diabetes development.",11.62
17,3,"However, the model also notes that the patient's plasma glucose concentration is 112, which slightly reduces the predicted risk, suggesting that their blood sugar levels are not excessively high.",8.84
17,4,"Additionally, the relatively low diabetes pedigree function of 0.24 indicates a weaker genetic predisposition, which further diminishes the probability of diabetes.",8.43
17,5,"Finally, the patient's diastolic blood pressure of 78 exerts a minimal negative influence on the prediction.",7.74
17,6,"Taken together, while certain factors such as age and BMI actively push the prediction toward a higher risk, the mitigating effects of glucose level, family history, and blood pressure collectively temper the model's overall assessment.",7.18
18,1,"In evaluating whether the patient has diabetes, the model first considered the patient's plasma glucose concentration, which was notably elevated.",37.69
18,2,This high glucose level played a substantial role in increasing the likelihood of a diabetes diagnosis.,18.82
18,3,"Building on this, the patient's body mass index was also significantly above average, further amplifying the model's confidence in a positive prediction.",12.51
18,4,"However, the patient's relatively young age exerted a counterbalancing effect, slightly reducing the predicted risk.",9.92
18,5,"Additionally, a lower diabetes pedigree function suggested a weaker genetic predisposition, which further diminished the probability of diabetes.",10.27
18,6,"Finally, the model took into account the patient's triceps skin fold thickness, which, while less influential, still contributed modestly to raising the predicted risk.",8.39
18,7,"Altogether, these factors interacted to shape the model's final assessment, with elevated glucose and BMI tipping the balance toward a higher likelihood of diabetes despite mitigating influences from age and family history.",7.38
19,1,"In evaluating whether the patient has diabetes, the model first considered the patient's Body Mass Index (BMI), which stood at 24.70.",23.51
19,2,"This relatively moderate BMI actively reduced the likelihood of diabetes, exerting the strongest downward influence on the prediction.",21.47
19,3,"Alongside this, the patient's plasma glucose concentration measured at 96 further diminished the probability, as lower glucose levels typically signal a reduced diabetes risk.",18.92
19,4,"However, the patient's age of 39 began to nudge the prediction upward, since advancing age can incrementally increase susceptibility to diabetes.",13.66
19,5,"Adding to this, the Diabetes Pedigree Function, reflecting a higher familial predisposition at 0.94, also contributed a slight upward push.",12.98
19,6,"Finally, the triceps skin fold thickness, measured at 34 mm, played a minor role in raising the predicted risk.",11.28
19,7,"Altogether, while certain factors like age and family history gently elevated the model's estimate, the combined mitigating effects of BMI and glucose levels ultimately led the model to predict a lower likelihood of diabetes for this patient.",9.69
20,1,"In evaluating whether this patient has diabetes, the model primarily considered several health indicators and their respective influences.",124.85
20,2,"At the outset, the patient's relatively low Body Mass Index (BMI) played a significant role in reducing the likelihood of diabetes, as a lower BMI is generally associated with a decreased risk.",13.3
20,3,"Building on this, the patient's plasma glucose concentration, while moderately elevated, further contributed to lowering the predicted risk, suggesting that their glucose levels do not strongly indicate diabetes in this context.",11.14
20,4,"As the analysis progressed, the patient's young age and absence of pregnancies continued to nudge the prediction downward, reflecting demographic factors that typically correlate with a lower probability of diabetes.",10.24
20,5,"Finally, although the patient's diabetes pedigree function—an indicator of genetic predisposition—slightly increased the risk, its effect was minimal compared to the other features.",10.08
20,6,"Altogether, these factors combined to guide the model toward a prediction that the patient is less likely to have diabetes.",8.88
21,1,"In evaluating whether the patient has diabetes, the model first considered the patient's plasma glucose concentration, which was measured at 93.",30.63
21,2,"This relatively low value played a significant role in reducing the likelihood of diabetes, as lower glucose levels are typically associated with a decreased risk.",15.12
21,3,"Meanwhile, the patient's body mass index stood at 35.30, and this elevated BMI exerted a modest upward influence on the prediction, reflecting the well-established link between higher body weight and increased diabetes risk.",10.18
21,4,"However, this effect was not strong enough to outweigh the impact of the glucose measurement.",8.84
21,5,"The patient's age, recorded at 25, also contributed to lowering the predicted risk, since younger individuals are generally less susceptible to diabetes.",7.45
21,6,"Additionally, the diabetes pedigree function, which captures genetic predisposition, was relatively low at 0.26, further nudging the prediction downward.",7.0
21,7,"Finally, the absence of pregnancies provided a slight additional reduction in risk.",7.15
21,8,"Taken together, these factors interacted such that the low glucose level and young age were the primary drivers behind the model's prediction that the patient is unlikely to have diabetes, despite the presence of a higher BMI.",6.59
22,1,"The model predicts a high likelihood of diabetes for this patient, primarily because their plasma glucose concentration is significantly elevated.",34.22
22,2,"This high glucose level exerts the strongest influence on the prediction, signaling impaired glucose regulation.",24.27
22,3,"In addition, the patient's body mass index is notably high, which further amplifies the risk by indicating substantial excess weight—a well-established contributor to diabetes.",13.56
22,4,"The patient's age also plays a meaningful role, as advancing age increases susceptibility to the disease.",11.02
22,5,"Moreover, the diabetes pedigree function, reflecting a family history of diabetes, subtly heightens the risk, while elevated insulin levels provide additional, albeit smaller, evidence supporting the prediction.",10.64
22,6,"Taken together, these factors interact to drive the model’s assessment, with each feature actively shaping the final outcome through its distinct contribution.",11.21
23,1,"In evaluating whether the patient has diabetes, the model first considered the patient's plasma glucose concentration, which was notably low.",41.76
23,2,"This low glucose level exerted a strong downward influence on the likelihood of diabetes, substantially reducing the predicted risk.",19.65
23,3,Although the patient's age and body mass index both nudged the prediction upward—reflecting the fact that older age and higher BMI are generally associated with increased diabetes risk—their effects were comparatively modest.,10.95
23,4,"The patient's history of multiple pregnancies also contributed slightly to raising the risk, but this influence was minor.",10.05
23,5,"Finally, the absence of measurable serum insulin provided a small negative adjustment, further lowering the predicted probability.",10.49
23,6,"Taken together, while several factors gently pushed the prediction toward a higher risk, the dominant effect of low glucose ultimately led the model to estimate a reduced likelihood that the patient has diabetes.",9.46
24,1,"In evaluating whether the patient has diabetes, the model primarily considered several health indicators and their respective values.",75.01
24,2,"To begin with, the patient's plasma glucose concentration was measured at 97, which actively contributed to lowering the predicted risk of diabetes, as lower glucose levels are generally associated with a reduced likelihood of the condition.",18.3
24,3,"This effect was further reinforced by the patient's young age of 22, which also diminished the probability, since younger individuals are statistically less prone to diabetes.",12.79
24,4,"Additionally, the patient's Body Mass Index (BMI) of 28.20 exerted a modest downward influence on the prediction, suggesting that while the BMI is slightly elevated, it does not strongly indicate diabetes in this context.",8.96
24,5,"The triceps skin fold thickness, recorded at 23 mm, played a minor role in decreasing the risk, reflecting that this measure did not provide significant evidence for diabetes.",8.26
24,6,"Finally, although the patient has experienced four pregnancies, this factor exerted only a minimal upward effect on the prediction.",7.9
24,7,"Taken together, these features interact to produce an overall assessment in which the patient's relatively low glucose level and young age serve as the primary reasons for the model's reduced estimate of diabetes risk.",7.79
25,1,"In evaluating whether the patient has diabetes, the model considered several key factors that collectively shaped its prediction.",76.94
25,2,"To begin with, the patient's relatively young age of 21 played a significant role in reducing the likelihood of diabetes, as younger individuals are generally at lower risk.",13.6
25,3,"This effect was further reinforced by the patient's plasma glucose concentration of 108, which, while not exceptionally low, still contributed to a decreased probability of diabetes according to the model's learned patterns.",9.51
25,4,"Additionally, the patient's diabetes pedigree function—a measure reflecting family history—was modest at 0.16, which further diminished the predicted risk.",8.72
