text_id,num_sentences,last_sentence,ppl
25,5,"However, the patient's body mass index (BMI) of 30.80 exerted an opposing influence, slightly increasing the likelihood of diabetes, since higher BMI values are commonly associated with elevated risk.",7.07
25,6,"Lastly, the fact that the patient has experienced two pregnancies contributed marginally to lowering the risk.",7.2
25,7,"Taken together, these factors interacted within the model to produce a nuanced assessment, where the protective effects of age, glucose level, family history, and pregnancy count outweighed the risk introduced by BMI, ultimately guiding the model toward a lower probability of diabetes for this patient.",6.59
26,1,"In this case, the model predicts a lower likelihood of diabetes for the patient, and this outcome unfolds as a result of several interrelated factors.",26.75
26,2,"To begin with, the patient's plasma glucose concentration is relatively low, which actively reduces the risk of diabetes and serves as the most influential factor in the model's reasoning.",13.44
26,3,"Building on this, the patient's body mass index is also on the lower side, further diminishing the probability of diabetes by indicating a healthier weight profile.",9.45
26,4,"As the narrative continues, the patient's young age contributes to the overall assessment, since younger individuals are generally less susceptible to diabetes.",8.44
26,5,"Additionally, the fact that the patient has experienced only one pregnancy and has a moderate insulin level both play minor yet reinforcing roles in lowering the predicted risk.",8.11
26,6,"Altogether, these features interact to guide the model toward its conclusion that the patient is unlikely to have diabetes.",7.74
27,1,The model predicts the likelihood of diabetes by weighing several key factors from the patient's profile.,38.56
27,2,"At the outset, the patient's elevated plasma glucose concentration stands out as the most influential driver, substantially increasing the predicted risk.",25.91
27,3,"This heightened glucose level signals impaired glucose regulation, which is a hallmark of diabetes.",19.65
27,4,"Building on this, the patient's age further amplifies the risk, as advancing age is commonly associated with a greater susceptibility to the disease.",12.1
27,5,"The model also takes into account the patient's body mass index, where a higher BMI actively contributes to the prediction by reflecting increased adiposity, a known risk factor for diabetes.",8.41
27,6,"Additionally, the diabetes pedigree function, which encapsulates the patient's genetic predisposition, subtly raises the risk, indicating that family history plays a supporting role in the model's reasoning.",7.99
27,7,"Finally, the patient's serum insulin level, while less impactful than the other features, still nudges the prediction upward, suggesting some degree of insulin resistance.",7.07
27,8,"Altogether, these interconnected factors combine to shape the model's assessment, culminating in a prediction that the patient is at an elevated risk for diabetes.",6.43
28,1,"In evaluating the likelihood that this patient has diabetes, the model first considered the patient's age of 22, which actively reduced the predicted risk, as younger individuals are generally less susceptible to diabetes.",25.23
28,2,"This downward influence was further reinforced by the patient's plasma glucose concentration of 117, which, while elevated, still contributed to lowering the risk in the model's assessment.",16.44
28,3,"Additionally, the absence of previous pregnancies slightly decreased the probability, reflecting the model's recognition that certain reproductive histories can affect diabetes risk.",14.79
28,4,"However, the patient's body mass index of 30.80 exerted a modest upward pressure on the prediction, as higher BMI values are commonly associated with increased diabetes risk.",10.67
28,5,"Finally, the serum insulin level of 188 provided a slight additional increase, though its effect was relatively minor.",10.88
28,6,"Taken together, these factors interacted to shape the model's overall prediction, with the protective effects of youth and moderate glucose levels outweighing the modest risk increases from BMI and insulin.",9.42
29,1,"In evaluating the likelihood that the patient has diabetes, the model first considered the patient's age of 44, which notably increased the predicted risk, as older age is often associated with a higher probability of developing diabetes.",17.38
29,2,"Building on this, the patient's elevated BMI of 33.80 further amplified the risk, reflecting the well-established link between higher body mass and diabetes susceptibility.",11.57
29,3,"Additionally, the patient's diabetes pedigree function, which measures genetic predisposition, contributed to the prediction by indicating a significant familial risk.",10.8
29,4,"However, the model also took into account the patient's plasma glucose concentration of 117, which slightly reduced the predicted risk, suggesting that the glucose level was not excessively high.",8.24
29,5,"Finally, the absence of previous pregnancies provided a modest downward influence on the risk estimate.",8.35
29,6,"Altogether, these factors interacted to shape the model's final prediction, with age, BMI, and family history driving the risk upward, while glucose level and pregnancy history offered some mitigating effects.",7.33
