text_id,sentence_index,removed_sentence,ppl_without_sentence,original_ppl,ppl_change
0,0,"The model predicted that the A team would have a player win the Man of the Match award, and this outcome was most strongly influenced by the team’s ability to score goals—netting 2 goals, which is higher than the typical match average, likely drew attention to standout individual performances.",12.52,9.32,3.2
0,1,"Interestingly, the relatively low number of corner kicks taken by the team may have slightly counted against them, as teams that dominate set-piece opportunities often control the game’s tempo and create more chances for star players to shine.",9.73,9.32,0.41
0,2,"The team’s four off-target attempts, while not exceptional, suggest a willingness to take risks and keep the opposition under pressure, which can sometimes highlight a player’s influence even if not every shot is on target.",10.3,9.32,0.98
0,3,"However, the team completed fewer passes and had less ball possession than average, indicating they may have played a more direct or counter-attacking style rather than controlling the game through sustained possession.",10.89,9.32,1.57
0,4,"Despite these factors, it was likely the decisive goals and the impact of key moments that tipped the prediction in favor of an A team player being recognized as Man of the Match, as goal-scoring often leaves the strongest impression on both fans and award panels.",10.15,9.32,0.83
1,0,"The model predicted that the A team would have a player win the Man of the Match award, and this outcome was most strongly influenced by the team’s ability to score a goal, which is often a decisive factor in individual recognition, even though their tally of one goal was slightly below the tournament average.",13.67,8.84,4.82
1,1,"Interestingly, the relatively low number of corners taken by the A team may have worked against them, as teams that create more set-piece opportunities often demonstrate attacking dominance, but in this case, the impact was outweighed by other factors.",9.84,8.84,1.0
1,2,"The team’s five off-target attempts suggest they were active in attack, keeping the opposition under pressure, which can help a standout player emerge even if not every shot is on target.",8.71,8.84,-0.14
1,3,"However, the A team completed far fewer passes and had much less ball possession than average, indicating they played a more direct or counter-attacking style rather than controlling the game through possession.",10.34,8.84,1.49
1,4,"Despite these disadvantages, the model recognized that a standout individual performance—perhaps a decisive goal or a series of impactful plays—can shine through even when a team is not dominant in traditional metrics like possession or passing, leading to the prediction of a Man of the Match award.",10.08,8.84,1.24
2,0,The model predicted that the A team would have a player receive the Man of the Match award.,14.03,10.88,3.14
2,1,"This decision was most strongly influenced by the number of goals scored, as scoring even a single goal is often a decisive factor in earning individual recognition, especially when goals are rare and valuable in football.",15.93,10.88,5.05
2,2,"However, the team had fewer corner kicks than average, which slightly worked against the prediction, perhaps suggesting less attacking pressure or fewer set-piece opportunities, but this was outweighed by the impact of the goal.",13.13,10.88,2.25
2,3,"The number of off-target attempts was close to typical, indicating the team was active in attack, which can also draw attention to standout individual performances.",11.13,10.88,0.25
2,4,"While the team’s passing and ball possession were both slightly above average, these factors played a smaller role, but they may have contributed to the overall impression of control and involvement, supporting the case for a player to be singled out for the award.",13.58,10.88,2.7
3,0,The model predicted that the A team would have a player receive the Man of the Match award.,13.52,10.99,2.52
3,1,"This outcome was most strongly influenced by the number of goals scored, as scoring even a single goal can be decisive in a match and often draws attention to standout performers, even though the team scored slightly below the tournament average.",17.67,10.99,6.68
3,2,"On the other hand, the relatively low number of corner kicks and passes compared to typical match statistics might have suggested less overall attacking play and ball control, but these factors were outweighed by the impact of the goal.",12.47,10.99,1.47
3,3,"The team also had a high number of off-target attempts, which, while not resulting in goals, could indicate an aggressive attacking approach that keeps the opposition under pressure and highlights individual effort.",12.98,10.99,1.99
3,4,"Although their ball possession was lower than average, sometimes a team can shine through efficiency and key moments rather than dominating possession, which may have helped a particular player stand out and secure the award.",10.84,10.99,-0.15
4,0,The model predicted that the A team would not have a player receive the Man of the Match award.,12.62,10.65,1.97
4,1,"The most influential factor in this decision was that the team did not score any goals, which is a significant departure from the typical performance and often a key driver for individual recognition in football.",15.04,10.65,4.4
4,2,"Despite dominating ball possession with 64%, well above the average, this control did not translate into the kind of decisive moments—like goals—that usually catch the eye of award selectors.",10.56,10.65,-0.09
4,3,"The team also earned a slightly above-average number of corners and completed a high number of passes, but these efforts likely seemed less impactful without a tangible result on the scoreboard.",12.65,10.65,2.0
4,4,"Even though they had a fair number of off-target attempts, the lack of goals overshadowed these efforts, suggesting that while the team played actively, they ultimately failed to produce the standout moments that lead to individual accolades.",12.75,10.65,2.11
5,0,The model predicted that the A team was not likely to have a player win the Man of the Match award in this football match.,12.17,10.97,1.2
5,1,"The most influential factor in this decision was that the team did not score any goals, which is a significant setback since goals are often the most visible and celebrated contributions in a match.",15.4,10.97,4.42
5,2,"While the team did manage to earn seven corners—well above the typical average—this attacking pressure did not translate into goals, which likely diminished the impact of their efforts.",11.24,10.97,0.27
5,3,"Their passing game was strong, with 484 passes completed, but without goals, even a high number of passes can seem less decisive in the eyes of those selecting the standout player.",11.12,10.97,0.15
5,4,"Although the team also had a fair number of off-target attempts and maintained average ball possession, these factors were not enough to outweigh the lack of goals, which is often the key to individual recognition in football.",13.37,10.97,2.4
6,0,The model predicted that the A team would not have a player receive the Man of the Match award in this football match.,8.83,7.89,0.94
6,1,"The most influential factor in this decision was that the team did not score any goals, which is a significant setback since goals are often the most visible and celebrated contributions in a match.",11.31,7.89,3.42
6,2,"While the team did manage to earn five corners—slightly above the average—this alone was not enough to sway the prediction, as corners are opportunities rather than direct achievements.",8.99,7.89,1.09
6,3,"The team also completed a high number of passes, suggesting good ball movement, but this did not compensate for the lack of goals, especially since their ball possession was slightly below average, indicating they may not have controlled the game.",10.48,7.89,2.59
6,4,"Ultimately, despite some positive aspects like passing and corners, the absence of goals likely overshadowed these efforts, as goal-scoring is typically the most decisive factor in earning individual accolades in football.",8.68,7.89,0.79
7,0,The model predicted that the A team would have a player receive the Man of the Match award.,15.27,11.61,3.66
7,1,"This outcome was most strongly influenced by the number of goals scored, as scoring even a single goal can be decisive in a match and often draws attention to standout performers, even though the team scored slightly below the tournament average.",16.25,11.61,4.64
7,2,"Interestingly, the relatively low number of corner kicks worked against the prediction, since teams that dominate and create more attacking opportunities—often reflected in higher corner counts—tend to have players recognized for their impact.",13.49,11.61,1.88
7,3,"The number of off-target attempts, which was close to the average, contributed positively, perhaps suggesting that the team was active in attack and kept the opposition under pressure, a quality that can highlight individual efforts.",13.42,11.61,1.81
7,4,"Although the team had fewer passes and less ball possession than typical, these factors played a smaller role, indicating that the model valued decisive moments and attacking intent over overall control in this particular prediction.",12.37,11.61,0.76
8,0,The model predicted that the A team would not have a player receive the Man of the Match award.,14.99,12.31,2.68
8,1,"This outcome was heavily influenced by the fact that the team did not score any goals, which is a significant factor since standout performances often involve goal contributions.",17.88,12.31,5.57
8,2,"Despite the team completing an impressive 698 passes—far above the typical match average—this high passing count alone was not enough to sway the prediction, perhaps because it did not translate into decisive moments or goals.",13.43,12.31,1.12
8,3,"The team also earned five corners and made seven off-target attempts, both slightly above average, suggesting they were active in attack but ultimately lacked the clinical edge needed to produce a match-winning performance.",14.08,12.31,1.77
8,4,"Even though A team dominated possession with 57%, this control did not result in the kind of impactful play that usually earns individual accolades, highlighting that possession and effort must be matched by tangible results to secure such recognition.",12.61,12.31,0.3
9,0,The model predicted that the A team would not have a player receive the Man of the Match award in this football match.,10.54,8.3,2.23
9,1,"The most influential factor in this decision was that the team did not score any goals, which is a significant setback since goals are often the most visible and celebrated contributions in a match.",11.07,8.3,2.77
9,2,"While the team did win a high number of corners, suggesting they were able to create attacking opportunities, this alone was not enough to outweigh the lack of goals.",9.61,8.3,1.31
9,3,"Their total number of passes was right around the tournament average, indicating a solid but not exceptional control of play, and their ball possession was slightly above average, showing they held the ball more than their opponents but perhaps without making it count on the scoreboard.",8.34,8.3,0.04
9,4,"Despite a reasonable number of off-target attempts, the absence of goals likely overshadowed these efforts, leading the model to conclude that no standout individual performance from the A team merited the Man of the Match recognition.",9.73,8.3,1.43
10,0,"The model predicted that the A team would have a player receive the Man of the Match award, and this outcome was most strongly influenced by the number of goals scored.",12.98,9.22,3.76
10,1,"Scoring a goal is often the most decisive factor in football, and although the A team scored just one goal—slightly below the tournament average—this goal may have been particularly crucial or memorable, which can sway the award decision.",10.33,9.22,1.11
10,2,"The next most influential factor was the high number of corner kicks earned by the A team, with 10 corners indicating sustained attacking pressure and opportunities to create dangerous moments, which often draw attention to standout individual performances.",10.27,9.22,1.05
10,3,"The team also had more off-target attempts than average, suggesting an aggressive approach in attack, which, while not always resulting in goals, can highlight a player’s influence and activity on the field.",10.16,9.22,0.94
10,4,"Although the A team had fewer passes and less ball possession than typical, their direct and assertive style may have allowed a key player to shine in pivotal moments, ultimately leading to the Man of the Match recognition.",10.98,9.22,1.76
11,0,"The model predicted that the A team would have a player receive the Man of the Match award, and the story behind this prediction starts with their remarkable goal-scoring performance: netting 5 goals, far surpassing the typical match average.",23.49,12.79,10.69
11,1,"This offensive firepower is often a decisive factor in individual accolades, as standout goal contributions tend to draw attention from award selectors.",14.0,12.79,1.21
11,2,"The team also earned 6 corner kicks, which not only reflects their attacking intent but likely provided more opportunities to create dangerous moments and showcase individual brilliance.",15.17,12.79,2.38
11,3,"Although their off-target attempts were slightly below average, this may suggest that their shots were more efficient or that their goals came from high-quality chances, further highlighting the impact of key players.",14.04,12.79,1.25
11,4,"Despite having fewer passes and less ball possession than average, the team's ability to convert limited opportunities into goals likely made their standout performers impossible to overlook for the Man of the Match honor.",15.06,12.79,2.26
12,0,The model predicted that the A team would not have a player receive the Man of the Match award.,11.97,8.92,3.05
12,1,"This outcome was most strongly influenced by the fact that the team failed to score any goals, a critical factor since standout performances are often linked to goal-scoring contributions.",12.63,8.92,3.72
12,2,"Additionally, the team had only one corner kick and completed significantly fewer passes than average, both of which suggest limited attacking opportunities and less control over the game.",10.93,8.92,2.01
12,3,"While the team did manage four off-target attempts, this alone was not enough to offset the lack of goals or overall possession.",9.77,8.92,0.85
12,4,"With just 34% ball possession, well below the typical average, it appears the A team struggled to assert themselves, making it unlikely for any individual to shine enough to earn the award.",10.13,8.92,1.22
13,0,"The model predicted that the A team would have a player win the Man of the Match award, and this outcome was strongly influenced by the team’s impressive goal-scoring performance, as they netted 2 goals—well above the typical match average.",19.21,12.13,7.08
13,1,"This attacking success was further supported by their high number of corner kicks, with 5 corners indicating sustained offensive pressure and frequent threats near the opponent’s goal.",12.12,12.13,-0.01
13,2,"Although the team had 6 off-target attempts, slightly more than average, this suggests they were consistently creating chances and keeping the opposition under pressure, which often draws attention to standout individual performances.",12.42,12.13,0.29
13,3,"Their passing game was also notable, with 485 passes completed, showing a level of control and teamwork that can help a player shine, even if passing itself was not a major driver in the model’s decision.",12.63,12.13,0.5
13,4,"Finally, the A team dominated ball possession at 59%, far above the average, which likely allowed their key players more opportunities to influence the game and catch the eye of the award selectors.",14.69,12.13,2.56
14,0,The model predicted that the A team was not likely to have a player receive the Man of the Match award.,9.5,7.9,1.6
14,1,"This outcome was strongly influenced by the team's low number of off-target attempts, which was well below what is typical in World Cup matches, suggesting a lack of attacking pressure or creativity in front of goal.",9.47,7.9,1.57
14,2,"Additionally, the team earned very few corner kicks, another sign that they struggled to put sustained pressure on their opponent’s defense.",8.73,7.9,0.83
14,3,"While the A team did manage to score two goals—slightly above the average for such matches—this positive contribution was outweighed by their low overall involvement, as seen in their limited number of passes and notably low ball possession percentage.",8.54,7.9,0.65
14,4,"Altogether, these factors paint a picture of a team that, despite some success in front of goal, was largely on the back foot and unable to dominate play, making it less likely for one of their players to stand out as the match’s top performer.",11.07,7.9,3.17
15,0,"The model predicted that the A team would have a player receive the Man of the Match award, and this outcome was strongly influenced by the team’s impressive goal-scoring performance, netting three goals—well above the typical match average.",12.8,9.34,3.46
15,1,"While the number of corners taken by the A team was lower than usual, suggesting they may not have dominated set-piece opportunities, this did not outweigh the impact of their goal tally.",10.5,9.34,1.16
15,2,"The team also had a slightly higher number of off-target attempts than average, indicating an aggressive attacking approach that likely kept the opposition under pressure and showcased individual flair.",9.24,9.34,-0.1
15,3,"Although their total passes and ball possession percentage were both below the norm, which might suggest less control over the game, these factors were less influential in the model’s decision.",10.16,9.34,0.83
15,4,"Ultimately, it was the A team’s ability to convert chances into goals that most likely tipped the scales, as standout goal-scoring performances are often a key reason for a player to be recognized as Man of the Match.",11.05,9.34,1.71
16,0,The model predicted that the A team would have a player receive the Man of the Match award.,13.25,11.65,1.6
16,1,"This outcome was most strongly influenced by the fact that the team scored a goal, which is often a decisive factor in individual recognition, even though their tally was slightly below the tournament average.",17.07,11.65,5.42
16,2,"Interestingly, the team had fewer corner kicks than most, which might suggest they were less dominant in attack, but this did not outweigh the positive impact of scoring.",15.13,11.65,3.49
16,3,"Their number of off-target attempts was also below average, indicating they created some chances but perhaps lacked precision, yet this still contributed positively, possibly reflecting an active attacking presence.",11.61,11.65,-0.04
16,4,"Although the team had fewer passes and less ball possession than typical, these factors played a smaller role, suggesting that standout moments—like scoring—can matter more than overall control when it comes to individual accolades.",13.53,11.65,1.88
17,0,The model predicted that the A team would not have a player receive the Man of the Match award.,9.29,7.8,1.49
17,1,"This outcome was heavily influenced by the fact that the team did not score any goals, which is a critical factor in earning individual recognition, as goal scorers often stand out in the eyes of award selectors.",10.92,7.8,3.11
17,2,"Despite this, the A team demonstrated impressive control over the game, completing 595 passes and maintaining 60% ball possession—both well above average—suggesting they dominated play but perhaps lacked the decisive moments that typically lead to standout performances.",9.91,7.8,2.11
17,3,"The team also earned 8 corners and made 9 off-target attempts, indicating they created numerous opportunities but struggled to convert them into goals or memorable moments.",8.31,7.8,0.51
17,4,"Ultimately, while the A team’s collective effort and control were notable, the absence of goals likely overshadowed their performance, making it difficult for any one player to shine enough to claim the Man of the Match honor.",9.4,7.8,1.6
18,0,"The model predicted that the A team would have a player win the Man of the Match award, and this outcome was strongly influenced by the team’s impressive goal-scoring performance, netting 3 goals—well above the typical match average.",17.82,11.14,6.67
18,1,"While the number of corners taken was slightly below average, this did not detract from the prediction, perhaps because corners alone do not always translate into decisive moments unless converted into goals.",12.08,11.14,0.93
18,2,"The team also had a high number of off-target attempts, suggesting an aggressive attacking style that, even if not always accurate, kept the pressure on the opposition and showcased individual initiative—qualities often noticed by award selectors.",11.96,11.14,0.82
18,3,"Their passing game was notably strong, with 492 passes completed, indicating control and teamwork, though this factor played a smaller role in the prediction.",11.2,11.14,0.05
18,4,"Finally, the A team dominated ball possession at 56%, which, while not the most influential factor, likely contributed to their ability to create scoring opportunities and maintain momentum, further supporting the case for a standout individual performance.",13.61,11.14,2.47
19,0,The model predicted that the A team would not have a player receive the Man of the Match award in this football match.,11.58,8.47,3.11
19,1,"The most influential factor in this decision was that the team did not score any goals, which is a significant departure from the typical performance and often a key driver for individual recognition.",10.11,8.47,1.64
19,2,"Despite this, the A team demonstrated impressive control of the game, completing 719 passes and holding 70% ball possession—both well above average—suggesting they dominated play but struggled to convert their efforts into tangible results.",9.94,8.47,1.47
19,3,"Their high number of corners and off-target attempts further indicate that while they created many opportunities, they lacked the finishing touch needed to make a decisive impact.",9.19,8.47,0.73
19,4,"Ultimately, the combination of strong possession and attacking intent was overshadowed by the absence of goals, which likely led the model to conclude that no standout individual performance would be recognized with the Man of the Match award.",10.58,8.47,2.11
20,0,"The model predicted that the A team would have a player win the Man of the Match award, and the story behind this prediction starts with their impressive goal-scoring performance: they netted 4 goals, far surpassing the typical match average, which is a strong indicator of standout individual contributions.",15.36,11.03,4.33
20,1,"Interestingly, despite not earning any corner kicks—a statistic that usually reflects attacking pressure—the team still managed to dominate the scoreboard, suggesting their goals came from open play or set pieces other than corners, which can sometimes make a player's performance even more remarkable.",11.35,11.03,0.32
20,2,"The number of off-target attempts was also notable, with 4 shots missing the mark; while not all efforts were on target, this level of attacking activity often signals a player who is heavily involved and taking risks, traits that can catch the eye of award selectors.",12.63,11.03,1.6
20,3,"However, the team completed fewer passes than average, which might suggest a more direct style of play or less overall control, but this did not hinder their ability to make decisive plays.",12.2,11.03,1.17
20,4,"Finally, with ball possession at 41%, below the typical share, the A team showed that even without dominating the ball, they could make their moments count—often, Man of the Match honors go to players who shine in games where their team overcomes such odds.",11.67,11.03,0.63
21,0,"The model predicted that the A team would have a player receive the Man of the Match award, and this outcome was strongly influenced by the team’s impressive goal-scoring performance, as they netted 2 goals—well above the typical match average.",18.56,11.82,6.74
21,1,"Their high number of corner kicks, totaling 7, also played a significant role, suggesting that the team maintained consistent attacking pressure and created numerous scoring opportunities.",14.53,11.82,2.72
21,2,"Although the team had 7 off-target attempts, which is slightly higher than average, this likely reflects an aggressive offensive approach that kept the opposition under constant threat.",12.69,11.82,0.87
21,3,"The A team also completed 492 passes, surpassing the usual number, which points to effective teamwork and control in midfield, even if passing alone was not the most decisive factor.",11.55,11.82,-0.26
21,4,"Finally, their commanding 59% ball possession indicates they dominated play, and while possession by itself doesn’t guarantee individual accolades, it often allows standout players to shine—helping explain why the model favored the A team for this honor.",12.16,11.82,0.34
22,0,"The model predicted that the A team would have a player win the Man of the Match award, and this outcome was most strongly influenced by the team’s ability to score goals—netting 2 in this match, which is higher than the typical average and often draws attention to standout individual performances.",13.8,9.78,4.02
22,1,"Interestingly, the relatively low number of corner kicks taken by the A team worked against this prediction, as teams that dominate set-piece opportunities often control the game and create more chances for their players to shine.",10.91,9.78,1.13
