text_id_shuff,num_sentences_shuff,last_sentence_shuff,ppl_shuff
23,3,"Although the team had 7 off-target attempts, which is slightly above average, this may reflect an aggressive attacking style that, while not always precise, kept the opposition under constant pressure and created memorable moments for individual players.",11.51
23,4,"Finally, their ball possession percentage was just under the average, but given their effectiveness in converting opportunities, it appears that the team made the most of their time on the ball, helping a standout player shine and ultimately secure the Man of the Match award.",10.79
23,5,"The model predicted that the A team would have a player receive the Man of the Match award, and this outcome was strongly influenced by the team’s impressive goal-scoring performance, as they netted 2 goals—higher than the typical match average.",10.48
24,1,"Although they had 4 off-target attempts, which is slightly below average, this may indicate that their attacks were more precise or that they capitalized on their best chances, further highlighting individual brilliance.",40.73
24,2,"Scoring 2 goals, which is higher than the typical average, likely caught the attention of both fans and analysts, as goals are often the most celebrated moments in a match and can directly lead to individual recognition.",20.2
24,3,"The team also earned 8 corner kicks, nearly doubling the usual number, suggesting they maintained significant attacking pressure and created many opportunities—traits often associated with standout performances.",17.75
24,4,"Additionally, with a remarkable 699 passes and 71% ball possession, far exceeding the norm, the A team demonstrated dominance and control throughout the match, making it more likely for one of their players to shine and be recognized as Man of the Match.",14.97
24,5,"The model predicted that the A team would have a player receive the Man of the Match award, and this outcome was strongly influenced by their impressive performance on the field.",13.16
25,1,"Their passing game was notably strong, with 524 passes completed, well above the average, hinting at a dominant and cohesive team performance that can help individual players stand out.",60.78
25,2,"Interestingly, while the number of corners taken by the A team was lower than average, this did not outweigh the positive impact of their goal tally, suggesting that converting chances into goals mattered more than simply creating set-piece opportunities.",27.46
25,3,"The team also had a high number of off-target attempts, which, although not all resulted in goals, indicated an aggressive attacking approach that likely kept the opposition under pressure and showcased individual flair—qualities often recognized in Man of the Match selections.",20.43
25,4,"Finally, the A team’s commanding 58% ball possession further reinforced their control over the match, making it more likely for one of their players to shine and be awarded Man of the Match.",15.2
25,5,"The model predicted that the A team would have a player receive the Man of the Match award, and this outcome was most strongly influenced by the team’s impressive goal-scoring performance, as they netted 2 goals—higher than the typical match average.",12.96
26,1,"The team also had a high number of off-target attempts, indicating an aggressive offensive approach that, while not always accurate, kept the opposition under constant threat and may have highlighted individual attacking efforts.",35.03
26,2,"This decision was most strongly influenced by the number of goals scored, as scoring is often the most direct path to individual recognition—even though the team scored just one goal, which is slightly below the tournament average, it may have been a decisive or spectacular goal.",21.64
26,3,"The next most influential factor was the remarkably high number of corner kicks earned by the A team, with 10 corners—more than double the average—suggesting sustained attacking pressure and opportunities to shine.",17.5
26,4,"Finally, the A team’s dominance in both total passes and ball possession—far above typical match averages—suggests they controlled the flow of the game, allowing their players more chances to stand out and impress, which often sways Man of the Match decisions in their favor.",13.92
26,5,The model predicted that the A team would have a player receive the Man of the Match award.,13.07
27,1,"While scoring 2 goals is a positive sign and actually above the average, it seems this was not enough to outweigh the lack of overall attacking activity and opportunities created.",32.76
27,2,"The most influential factor was the low number of off-target attempts—just 2, which is well below what is typically seen, suggesting the team may not have been very aggressive or threatening in attack.",18.34
27,3,"Similarly, the team only earned 2 corner kicks, another sign that they struggled to put sustained pressure on their opponents’ defense.",12.9
27,4,"Additionally, the team completed far fewer passes and had less ball possession than average, indicating they may have been outplayed in terms of control and buildup, which likely contributed to the model’s decision that no standout individual performance would be recognized with the award.",12.05
27,5,The model predicted that the A team was not likely to have a player receive the Man of the Match award in this football match.,11.6
28,1,"Although their number of off-target attempts was slightly below average, it suggests that their attacks were more efficient, possibly making their goals even more memorable.",60.42
28,2,"This attacking success likely put their players in the spotlight, since scoring is often a decisive factor in individual recognition.",45.64
28,3,"The team also earned 6 corner kicks, showing they maintained offensive pressure and created multiple opportunities, which can further highlight standout performances.",35.42
28,4,"Interestingly, despite having fewer passes and less ball possession than average, the team’s ability to make the most of their chances likely made their players’ contributions stand out, reinforcing the model’s prediction.",22.02
28,5,"The model predicted that the A team would have a player receive the Man of the Match award, and this outcome was most strongly influenced by the team’s impressive goal-scoring performance, as they netted 2 goals—well above the tournament average.",16.44
29,1,"The number of off-target attempts was slightly above average, indicating that the team was active in attack, and this offensive intent may have helped a player stand out despite not all shots being on target.",39.96
29,2,"This outcome was most strongly influenced by the fact that the team scored a goal, which is often a decisive factor in individual recognition, even though their tally was slightly below the tournament average.",22.37
29,3,"Interestingly, the relatively low number of corner kicks worked against the prediction, perhaps suggesting that the team was less dominant in creating set-piece opportunities, which can sometimes lead to standout moments.",17.47
29,4,"Although the team completed more passes than average and had nearly average ball possession, these factors played a smaller role, hinting that individual brilliance—often reflected in goals and attacking efforts—mattered more than overall team control in this prediction.",15.12
29,5,The model predicted that the A team would have a player receive the Man of the Match award.,14.47
