id,text,reversed_text,shuffled_text,num_sentences,ppl,ppl_reversed,ppl_shuffled,ppl_diff_reversed,ppl_diff_shuffled,ppl_ratio_reversed,ppl_ratio_shuffled,ppl_loo_mean,ppl_loo_std,ppl_loo_min,ppl_loo_max,ppl_cumulative_slope,ppl_cumulative_mean,ppl_cumulative_std,ppl_cumulative_first,ppl_cumulative_last,ppl_cumulative_rev_slope,ppl_cumulative_rev_mean,ppl_cumulative_rev_std,ppl_cumulative_rev_first,ppl_cumulative_rev_last,ppl_cumulative_shuff_slope,ppl_cumulative_shuff_mean,ppl_cumulative_shuff_std,ppl_cumulative_shuff_first,ppl_cumulative_shuff_last
21,"The model predicts that the student will pass the mathematics course, primarily because of their strong academic performance throughout the year. At the outset, the student's impressive second period grade of 13 exerts the most significant positive influence, signaling consistent mastery of the material and boosting the likelihood of passing. This positive trajectory is further reinforced by the first period grade of 11, which, while slightly lower, still demonstrates a solid foundation in mathematics. Although the student has accumulated six absences, this factor only slightly diminishes the probability of passing, as its impact is relatively minor compared to the grades. The student's age of 15 and the absence of any previous class failures also play modest but supportive roles, subtly enhancing the prediction. Altogether, the model weaves these factors into a coherent assessment, concluding that the student's academic strengths decisively outweigh any minor setbacks, leading to a confident prediction of success.","Altogether, the model weaves these factors into a coherent assessment, concluding that the student's academic strengths decisively outweigh any minor setbacks, leading to a confident prediction of success. The student's age of 15 and the absence of any previous class failures also play modest but supportive roles, subtly enhancing the prediction. Although the student has accumulated six absences, this factor only slightly diminishes the probability of passing, as its impact is relatively minor compared to the grades. This positive trajectory is further reinforced by the first period grade of 11, which, while slightly lower, still demonstrates a solid foundation in mathematics. At the outset, the student's impressive second period grade of 13 exerts the most significant positive influence, signaling consistent mastery of the material and boosting the likelihood of passing. The model predicts that the student will pass the mathematics course, primarily because of their strong academic performance throughout the year.","Although the student has accumulated six absences, this factor only slightly diminishes the probability of passing, as its impact is relatively minor compared to the grades. At the outset, the student's impressive second period grade of 13 exerts the most significant positive influence, signaling consistent mastery of the material and boosting the likelihood of passing. This positive trajectory is further reinforced by the first period grade of 11, which, while slightly lower, still demonstrates a solid foundation in mathematics. The student's age of 15 and the absence of any previous class failures also play modest but supportive roles, subtly enhancing the prediction. The model predicts that the student will pass the mathematics course, primarily because of their strong academic performance throughout the year. Altogether, the model weaves these factors into a coherent assessment, concluding that the student's academic strengths decisively outweigh any minor setbacks, leading to a confident prediction of success.",6,9.41,12.98,11.77,3.56,2.36,1.38,1.25,11.1,0.75,9.76,12.27,-4.2796,16.92,8.01,29.5,9.41,-4.2737,21.43,7.57,34.48,12.98,-5.0697,20.46,9.64,38.87,11.77
22,"At the outset, the model considered the student's academic performance, particularly focusing on their grades from the first and second periods. The relatively low scores in both G1 and G2 exerted a substantial downward influence on the likelihood of passing, as these grades serve as strong indicators of overall course mastery. As the narrative unfolds, the student's age, being 15, contributed a slight positive effect, perhaps reflecting a maturity level that could support academic success. Additionally, the fact that the student chose the school for its reputation subtly bolstered the prediction, suggesting a possible alignment with a motivated peer group or a supportive environment. Finally, the student's very good health status provided a modest yet meaningful boost, implying that well-being can enhance learning outcomes. Ultimately, while positive factors such as age, school choice, and health nudged the prediction upward, the dominant negative impact of the earlier grades led the model to anticipate a higher risk of failing the mathematics course.","Ultimately, while positive factors such as age, school choice, and health nudged the prediction upward, the dominant negative impact of the earlier grades led the model to anticipate a higher risk of failing the mathematics course. Finally, the student's very good health status provided a modest yet meaningful boost, implying that well-being can enhance learning outcomes. Additionally, the fact that the student chose the school for its reputation subtly bolstered the prediction, suggesting a possible alignment with a motivated peer group or a supportive environment. As the narrative unfolds, the student's age, being 15, contributed a slight positive effect, perhaps reflecting a maturity level that could support academic success. The relatively low scores in both G1 and G2 exerted a substantial downward influence on the likelihood of passing, as these grades serve as strong indicators of overall course mastery. At the outset, the model considered the student's academic performance, particularly focusing on their grades from the first and second periods.","Additionally, the fact that the student chose the school for its reputation subtly bolstered the prediction, suggesting a possible alignment with a motivated peer group or a supportive environment. The relatively low scores in both G1 and G2 exerted a substantial downward influence on the likelihood of passing, as these grades serve as strong indicators of overall course mastery. As the narrative unfolds, the student's age, being 15, contributed a slight positive effect, perhaps reflecting a maturity level that could support academic success. Finally, the student's very good health status provided a modest yet meaningful boost, implying that well-being can enhance learning outcomes. At the outset, the model considered the student's academic performance, particularly focusing on their grades from the first and second periods. Ultimately, while positive factors such as age, school choice, and health nudged the prediction upward, the dominant negative impact of the earlier grades led the model to anticipate a higher risk of failing the mathematics course.",6,11.96,15.18,17.01,3.22,5.05,1.27,1.42,14.28,0.52,13.51,15.25,-3.7997,19.02,7.37,34.36,11.96,-5.9985,26.46,10.59,43.39,15.18,-10.8169,34.65,21.52,80.02,17.01
23,"The model predicts that the student will pass the mathematics course, primarily because of their strong academic performance throughout the year. At the outset, the student's impressive second period grade of 12 exerts the most significant positive influence, signaling consistent mastery of the material and boosting the likelihood of passing. This positive momentum is further reinforced by the first period grade of 14, which continues to elevate the prediction by demonstrating early competence. Although the student has expressed no particular desire to pursue higher education, this factor only slightly diminishes the probability of passing, suggesting that academic achievement can outweigh motivational factors in this context. Meanwhile, the student's low number of absences and absence of prior class failures each contribute modestly to the prediction, indicating that regular attendance and a clean academic record subtly support the overall positive outlook. Taken together, these interconnected factors culminate in a strong expectation that the student will successfully pass the course.","Taken together, these interconnected factors culminate in a strong expectation that the student will successfully pass the course. Meanwhile, the student's low number of absences and absence of prior class failures each contribute modestly to the prediction, indicating that regular attendance and a clean academic record subtly support the overall positive outlook. Although the student has expressed no particular desire to pursue higher education, this factor only slightly diminishes the probability of passing, suggesting that academic achievement can outweigh motivational factors in this context. This positive momentum is further reinforced by the first period grade of 14, which continues to elevate the prediction by demonstrating early competence. At the outset, the student's impressive second period grade of 12 exerts the most significant positive influence, signaling consistent mastery of the material and boosting the likelihood of passing. The model predicts that the student will pass the mathematics course, primarily because of their strong academic performance throughout the year.","Although the student has expressed no particular desire to pursue higher education, this factor only slightly diminishes the probability of passing, suggesting that academic achievement can outweigh motivational factors in this context. At the outset, the student's impressive second period grade of 12 exerts the most significant positive influence, signaling consistent mastery of the material and boosting the likelihood of passing. This positive momentum is further reinforced by the first period grade of 14, which continues to elevate the prediction by demonstrating early competence. Meanwhile, the student's low number of absences and absence of prior class failures each contribute modestly to the prediction, indicating that regular attendance and a clean academic record subtly support the overall positive outlook. The model predicts that the student will pass the mathematics course, primarily because of their strong academic performance throughout the year. Taken together, these interconnected factors culminate in a strong expectation that the student will successfully pass the course.",6,11.18,14.61,13.22,3.44,2.04,1.31,1.18,12.83,0.63,11.8,13.68,-3.8879,18.98,6.82,29.5,11.18,-2.9537,20.56,5.42,30.67,14.61,-4.1199,20.94,7.3,32.73,13.22
24,"The model predicts the student's likelihood of passing the mathematics course by weighing several key factors from their academic record and personal background. At the heart of this prediction lies the student's strong performance in the second period, as reflected by a high grade of 10, which exerts the most significant positive influence and substantially boosts the chances of passing. Although the first period grade is also relatively high at 9, its impact is slightly negative, suggesting that the model places greater emphasis on recent academic improvement rather than earlier performance. Meanwhile, the student's nine absences contribute a modest positive effect, indicating that, in this case, attendance did not detract from the overall prediction—perhaps because the student's grades compensate for missed days. The student's age of 18 introduces a small negative influence, hinting that being older than typical classmates may slightly lower the predicted probability of passing. Finally, the absence of any previous class failures adds a subtle positive effect, reinforcing the model's confidence in the student's ability to succeed. Altogether, these intertwined factors lead the model to its final prediction, with the student's recent academic achievements playing the most decisive role.","Altogether, these intertwined factors lead the model to its final prediction, with the student's recent academic achievements playing the most decisive role. Finally, the absence of any previous class failures adds a subtle positive effect, reinforcing the model's confidence in the student's ability to succeed. The student's age of 18 introduces a small negative influence, hinting that being older than typical classmates may slightly lower the predicted probability of passing. Meanwhile, the student's nine absences contribute a modest positive effect, indicating that, in this case, attendance did not detract from the overall prediction—perhaps because the student's grades compensate for missed days. Although the first period grade is also relatively high at 9, its impact is slightly negative, suggesting that the model places greater emphasis on recent academic improvement rather than earlier performance. At the heart of this prediction lies the student's strong performance in the second period, as reflected by a high grade of 10, which exerts the most significant positive influence and substantially boosts the chances of passing. The model predicts the student's likelihood of passing the mathematics course by weighing several key factors from their academic record and personal background.","At the heart of this prediction lies the student's strong performance in the second period, as reflected by a high grade of 10, which exerts the most significant positive influence and substantially boosts the chances of passing. Meanwhile, the student's nine absences contribute a modest positive effect, indicating that, in this case, attendance did not detract from the overall prediction—perhaps because the student's grades compensate for missed days. The student's age of 18 introduces a small negative influence, hinting that being older than typical classmates may slightly lower the predicted probability of passing. Although the first period grade is also relatively high at 9, its impact is slightly negative, suggesting that the model places greater emphasis on recent academic improvement rather than earlier performance. Altogether, these intertwined factors lead the model to its final prediction, with the student's recent academic achievements playing the most decisive role. The model predicts the student's likelihood of passing the mathematics course by weighing several key factors from their academic record and personal background. Finally, the absence of any previous class failures adds a subtle positive effect, reinforcing the model's confidence in the student's ability to succeed.",7,8.37,10.51,10.2,2.14,1.83,1.26,1.22,9.42,1.0,8.38,11.6,-2.8624,13.89,6.43,27.64,8.37,-4.172,18.45,9.57,39.69,10.51,-2.2654,14.35,5.32,26.03,10.2
25,"The model predicts that the student is likely to fail the mathematics course, and this outcome is primarily shaped by the student’s academic history and prior performance. At the outset, the student’s second period grade, which is relatively low, exerts the strongest negative influence, signaling that recent struggles in mathematics have significantly diminished the likelihood of passing. This effect is compounded by the first period grade, which, being below average as well, further undermines the student’s chances by indicating a consistent pattern of underperformance throughout the year. Additionally, the student’s record of two previous class failures amplifies the risk, as it suggests persistent academic challenges that the model interprets as barriers to success. However, the narrative takes a slight turn with the presence of extra paid classes and the student’s age; both factors contribute modest positive effects. The student’s participation in paid classes hints at an effort to improve, and being 16 years old may reflect a maturity that could aid learning. Nevertheless, these positive influences are not sufficient to counterbalance the substantial negative impact of the student’s grades and history of failures. Thus, the model’s prediction emerges from the interplay of these factors, ultimately concluding that the student is at high risk of failing the mathematics course.","Thus, the model’s prediction emerges from the interplay of these factors, ultimately concluding that the student is at high risk of failing the mathematics course. Nevertheless, these positive influences are not sufficient to counterbalance the substantial negative impact of the student’s grades and history of failures. The student’s participation in paid classes hints at an effort to improve, and being 16 years old may reflect a maturity that could aid learning. However, the narrative takes a slight turn with the presence of extra paid classes and the student’s age; both factors contribute modest positive effects. Additionally, the student’s record of two previous class failures amplifies the risk, as it suggests persistent academic challenges that the model interprets as barriers to success. This effect is compounded by the first period grade, which, being below average as well, further undermines the student’s chances by indicating a consistent pattern of underperformance throughout the year. At the outset, the student’s second period grade, which is relatively low, exerts the strongest negative influence, signaling that recent struggles in mathematics have significantly diminished the likelihood of passing. The model predicts that the student is likely to fail the mathematics course, and this outcome is primarily shaped by the student’s academic history and prior performance.","Additionally, the student’s record of two previous class failures amplifies the risk, as it suggests persistent academic challenges that the model interprets as barriers to success. However, the narrative takes a slight turn with the presence of extra paid classes and the student’s age; both factors contribute modest positive effects. Nevertheless, these positive influences are not sufficient to counterbalance the substantial negative impact of the student’s grades and history of failures. Thus, the model’s prediction emerges from the interplay of these factors, ultimately concluding that the student is at high risk of failing the mathematics course. This effect is compounded by the first period grade, which, being below average as well, further undermines the student’s chances by indicating a consistent pattern of underperformance throughout the year. The student’s participation in paid classes hints at an effort to improve, and being 16 years old may reflect a maturity that could aid learning. The model predicts that the student is likely to fail the mathematics course, and this outcome is primarily shaped by the student’s academic history and prior performance. At the outset, the student’s second period grade, which is relatively low, exerts the strongest negative influence, signaling that recent struggles in mathematics have significantly diminished the likelihood of passing.",8,7.12,11.05,10.05,3.93,2.93,1.55,1.41,7.95,0.35,7.57,8.42,-1.8343,11.9,4.71,21.59,7.12,-1.6714,16.44,4.03,24.57,11.05,-3.8119,17.97,10.13,38.28,10.05
26,"The model predicts that the student will pass the mathematics course, primarily because their strong performance in both the first and second grading periods exerts a substantial positive influence on the outcome. Specifically, the student’s consistent grades of 12 in both periods signal a reliable academic foundation, which the model interprets as a key driver of success. Furthermore, the absence of prior class failures reinforces this positive trajectory, suggesting that the student has not struggled significantly in the past. Although the student has a small number of absences and only goes out with friends infrequently, these factors play a comparatively minor role in shaping the prediction. Altogether, the combination of solid academic achievement and a lack of negative academic history leads the model to confidently anticipate that the student will pass.","Altogether, the combination of solid academic achievement and a lack of negative academic history leads the model to confidently anticipate that the student will pass. Although the student has a small number of absences and only goes out with friends infrequently, these factors play a comparatively minor role in shaping the prediction. Furthermore, the absence of prior class failures reinforces this positive trajectory, suggesting that the student has not struggled significantly in the past. Specifically, the student’s consistent grades of 12 in both periods signal a reliable academic foundation, which the model interprets as a key driver of success. The model predicts that the student will pass the mathematics course, primarily because their strong performance in both the first and second grading periods exerts a substantial positive influence on the outcome.","Although the student has a small number of absences and only goes out with friends infrequently, these factors play a comparatively minor role in shaping the prediction. Specifically, the student’s consistent grades of 12 in both periods signal a reliable academic foundation, which the model interprets as a key driver of success. Furthermore, the absence of prior class failures reinforces this positive trajectory, suggesting that the student has not struggled significantly in the past. Altogether, the combination of solid academic achievement and a lack of negative academic history leads the model to confidently anticipate that the student will pass. The model predicts that the student will pass the mathematics course, primarily because their strong performance in both the first and second grading periods exerts a substantial positive influence on the outcome.",5,10.04,13.96,12.75,3.92,2.71,1.39,1.27,12.01,1.3,10.65,14.34,-3.1403,14.77,4.68,22.65,10.04,-5.5237,22.06,8.89,39.08,13.96,-6.405,22.51,9.41,38.09,12.75
27,"The model predicts that the student will pass the mathematics course, primarily because their strong performance in the second period, reflected by a high grade of 11, significantly boosts their chances of success. This positive momentum is somewhat tempered by a lower first period grade of 8, which slightly detracts from the overall prediction. However, the student’s young age of 15 subtly contributes to a favorable outcome, suggesting that younger students in this context may have a slight advantage. Notably, the student has no recorded absences, which helps maintain their likelihood of passing, as consistent attendance is generally associated with better academic results. Finally, the student’s low frequency of going out with friends adds a modest positive influence, implying that a more focused social life may support academic achievement. Taken together, these factors interact to shape the model’s confident prediction that the student will pass.","Taken together, these factors interact to shape the model’s confident prediction that the student will pass. Finally, the student’s low frequency of going out with friends adds a modest positive influence, implying that a more focused social life may support academic achievement. Notably, the student has no recorded absences, which helps maintain their likelihood of passing, as consistent attendance is generally associated with better academic results. However, the student’s young age of 15 subtly contributes to a favorable outcome, suggesting that younger students in this context may have a slight advantage. This positive momentum is somewhat tempered by a lower first period grade of 8, which slightly detracts from the overall prediction. The model predicts that the student will pass the mathematics course, primarily because their strong performance in the second period, reflected by a high grade of 11, significantly boosts their chances of success.","Notably, the student has no recorded absences, which helps maintain their likelihood of passing, as consistent attendance is generally associated with better academic results. This positive momentum is somewhat tempered by a lower first period grade of 8, which slightly detracts from the overall prediction. However, the student’s young age of 15 subtly contributes to a favorable outcome, suggesting that younger students in this context may have a slight advantage. Finally, the student’s low frequency of going out with friends adds a modest positive influence, implying that a more focused social life may support academic achievement. The model predicts that the student will pass the mathematics course, primarily because their strong performance in the second period, reflected by a high grade of 11, significantly boosts their chances of success. Taken together, these factors interact to shape the model’s confident prediction that the student will pass.",6,8.83,11.47,11.02,2.64,2.19,1.3,1.25,10.37,1.17,9.5,12.91,-3.5482,14.65,6.8,28.49,8.83,-7.7704,24.28,15.04,54.81,11.47,-4.3211,18.92,7.69,31.82,11.02
