id,text,reversed_text,shuffled_text,num_sentences,ppl,ppl_reversed,ppl_shuffled,ppl_diff_reversed,ppl_diff_shuffled,ppl_ratio_reversed,ppl_ratio_shuffled,ppl_loo_mean,ppl_loo_std,ppl_loo_min,ppl_loo_max,ppl_cumulative_slope,ppl_cumulative_mean,ppl_cumulative_std,ppl_cumulative_first,ppl_cumulative_last,ppl_cumulative_rev_slope,ppl_cumulative_rev_mean,ppl_cumulative_rev_std,ppl_cumulative_rev_first,ppl_cumulative_rev_last,ppl_cumulative_shuff_slope,ppl_cumulative_shuff_mean,ppl_cumulative_shuff_std,ppl_cumulative_shuff_first,ppl_cumulative_shuff_last
14,"The model predicts that the student will pass the mathematics course, primarily because their strong performance in the first and second grading periods has set a solid academic foundation. Specifically, the student’s second period grade of 10 and first period grade of 12 both contribute significantly to the positive prediction, indicating consistent achievement over time. Furthermore, the absence of any previous class failures reassures the model that the student has not struggled with similar coursework in the past. The student’s low number of absences suggests regular engagement with the class, which further supports the likelihood of success. Finally, participation in extra paid classes provides additional academic support, reinforcing the model’s confidence in a passing outcome. Altogether, these factors interact to create a compelling case for the student’s ability to pass the course.","Altogether, these factors interact to create a compelling case for the student’s ability to pass the course. Finally, participation in extra paid classes provides additional academic support, reinforcing the model’s confidence in a passing outcome. The student’s low number of absences suggests regular engagement with the class, which further supports the likelihood of success. Furthermore, the absence of any previous class failures reassures the model that the student has not struggled with similar coursework in the past. Specifically, the student’s second period grade of 10 and first period grade of 12 both contribute significantly to the positive prediction, indicating consistent achievement over time. The model predicts that the student will pass the mathematics course, primarily because their strong performance in the first and second grading periods has set a solid academic foundation.","The student’s low number of absences suggests regular engagement with the class, which further supports the likelihood of success. Specifically, the student’s second period grade of 10 and first period grade of 12 both contribute significantly to the positive prediction, indicating consistent achievement over time. Furthermore, the absence of any previous class failures reassures the model that the student has not struggled with similar coursework in the past. Finally, participation in extra paid classes provides additional academic support, reinforcing the model’s confidence in a passing outcome. The model predicts that the student will pass the mathematics course, primarily because their strong performance in the first and second grading periods has set a solid academic foundation. Altogether, these factors interact to create a compelling case for the student’s ability to pass the course.",6,9.2,11.43,12.1,2.24,2.91,1.24,1.32,10.57,1.13,9.18,12.79,-3.6212,14.83,7.18,29.67,9.2,-3.9815,19.66,8.69,23.56,11.43,-3.4519,17.6,7.26,33.16,12.1
15,"The model predicts the student's likelihood of passing the mathematics course by weighing several key factors from their academic and personal background. At the outset, the student's second period grade emerges as the most influential factor, exerting a strong negative impact on the prediction; a lower grade here signals academic struggles that significantly diminish the chances of passing. This effect is compounded by the first period grade, which, while slightly higher, still contributes negatively, reinforcing the impression of consistent academic challenges throughout the year. However, the narrative shifts as we consider the student's mother’s education level, which, despite being limited to primary education, offers a modest positive influence—perhaps reflecting a supportive home environment that partially offsets academic difficulties. Additionally, the student’s participation in extra paid classes introduces another positive element, suggesting proactive efforts to improve performance. Finally, the student’s age, though only a minor factor, nudges the prediction upward, possibly indicating maturity or experience. Taken together, these intertwined factors reveal that while the student faces notable academic hurdles, certain personal and familial supports work in tandem to slightly bolster their prospects.","Taken together, these intertwined factors reveal that while the student faces notable academic hurdles, certain personal and familial supports work in tandem to slightly bolster their prospects. Finally, the student’s age, though only a minor factor, nudges the prediction upward, possibly indicating maturity or experience. Additionally, the student’s participation in extra paid classes introduces another positive element, suggesting proactive efforts to improve performance. However, the narrative shifts as we consider the student's mother’s education level, which, despite being limited to primary education, offers a modest positive influence—perhaps reflecting a supportive home environment that partially offsets academic difficulties. This effect is compounded by the first period grade, which, while slightly higher, still contributes negatively, reinforcing the impression of consistent academic challenges throughout the year. At the outset, the student's second period grade emerges as the most influential factor, exerting a strong negative impact on the prediction; a lower grade here signals academic struggles that significantly diminish the chances of passing. The model predicts the student's likelihood of passing the mathematics course by weighing several key factors from their academic and personal background.","At the outset, the student's second period grade emerges as the most influential factor, exerting a strong negative impact on the prediction; a lower grade here signals academic struggles that significantly diminish the chances of passing. However, the narrative shifts as we consider the student's mother’s education level, which, despite being limited to primary education, offers a modest positive influence—perhaps reflecting a supportive home environment that partially offsets academic difficulties. Additionally, the student’s participation in extra paid classes introduces another positive element, suggesting proactive efforts to improve performance. This effect is compounded by the first period grade, which, while slightly higher, still contributes negatively, reinforcing the impression of consistent academic challenges throughout the year. Taken together, these intertwined factors reveal that while the student faces notable academic hurdles, certain personal and familial supports work in tandem to slightly bolster their prospects. The model predicts the student's likelihood of passing the mathematics course by weighing several key factors from their academic and personal background. Finally, the student’s age, though only a minor factor, nudges the prediction upward, possibly indicating maturity or experience.",7,10.78,15.51,12.78,4.73,2.0,1.44,1.19,12.2,1.16,11.06,13.92,-2.6665,15.92,5.95,28.34,10.78,-11.2608,36.29,26.43,96.12,15.51,-2.5007,17.0,6.29,31.76,12.78
16,"The model predicts that the student is likely to pass the mathematics course, primarily because of their strong academic performance in both the first and second periods. Specifically, the student's second period grade stands out as the most influential factor, substantially increasing the likelihood of passing. This positive effect is further reinforced by a solid first period grade, which also contributes meaningfully to the prediction. Although the student has experienced a previous class failure and is slightly older than typical classmates, these factors exert only a minor downward influence on the outcome. Additionally, the student's frequent social outings with friends have a negligible negative impact. Taken together, the model concludes that the student's consistent academic achievements outweigh the modest risks posed by past failures, age, and social activities, leading to a confident prediction of success in the course.","Taken together, the model concludes that the student's consistent academic achievements outweigh the modest risks posed by past failures, age, and social activities, leading to a confident prediction of success in the course. Additionally, the student's frequent social outings with friends have a negligible negative impact. Although the student has experienced a previous class failure and is slightly older than typical classmates, these factors exert only a minor downward influence on the outcome. This positive effect is further reinforced by a solid first period grade, which also contributes meaningfully to the prediction. Specifically, the student's second period grade stands out as the most influential factor, substantially increasing the likelihood of passing. The model predicts that the student is likely to pass the mathematics course, primarily because of their strong academic performance in both the first and second periods.","Although the student has experienced a previous class failure and is slightly older than typical classmates, these factors exert only a minor downward influence on the outcome. Specifically, the student's second period grade stands out as the most influential factor, substantially increasing the likelihood of passing. This positive effect is further reinforced by a solid first period grade, which also contributes meaningfully to the prediction. Additionally, the student's frequent social outings with friends have a negligible negative impact. The model predicts that the student is likely to pass the mathematics course, primarily because of their strong academic performance in both the first and second periods. Taken together, the model concludes that the student's consistent academic achievements outweigh the modest risks posed by past failures, age, and social activities, leading to a confident prediction of success in the course.",6,8.57,12.97,10.76,4.4,2.2,1.51,1.26,10.41,0.95,9.13,12.14,-2.2197,12.7,4.49,21.96,8.57,-6.1507,25.2,11.11,44.62,12.97,-7.7364,24.35,14.95,55.1,10.76
17,"The model predicts that the student is likely to fail the mathematics course, and this outcome is primarily shaped by several interconnected factors. At the outset, the student's grades in both the first and second periods stand out as significant contributors; both G1 and G2 are relatively low, and these underwhelming performances actively diminish the likelihood of passing. As the narrative unfolds, the student's history of past class failures further compounds this negative outlook, signaling a persistent struggle with academic success that the model interprets as a warning sign. Although the student has accumulated a moderate number of absences, this factor exerts only a slight upward influence, offering minimal compensation for the otherwise discouraging academic record. Finally, the absence of extra paid classes subtly nudges the prediction further toward failure, as the lack of additional support suggests fewer opportunities for improvement. Taken together, these elements interact to create a coherent story in which consistent academic challenges and limited support mechanisms drive the model's prediction that the student will not pass the course.","Taken together, these elements interact to create a coherent story in which consistent academic challenges and limited support mechanisms drive the model's prediction that the student will not pass the course. Finally, the absence of extra paid classes subtly nudges the prediction further toward failure, as the lack of additional support suggests fewer opportunities for improvement. Although the student has accumulated a moderate number of absences, this factor exerts only a slight upward influence, offering minimal compensation for the otherwise discouraging academic record. As the narrative unfolds, the student's history of past class failures further compounds this negative outlook, signaling a persistent struggle with academic success that the model interprets as a warning sign. At the outset, the student's grades in both the first and second periods stand out as significant contributors; both G1 and G2 are relatively low, and these underwhelming performances actively diminish the likelihood of passing. The model predicts that the student is likely to fail the mathematics course, and this outcome is primarily shaped by several interconnected factors.","Although the student has accumulated a moderate number of absences, this factor exerts only a slight upward influence, offering minimal compensation for the otherwise discouraging academic record. At the outset, the student's grades in both the first and second periods stand out as significant contributors; both G1 and G2 are relatively low, and these underwhelming performances actively diminish the likelihood of passing. As the narrative unfolds, the student's history of past class failures further compounds this negative outlook, signaling a persistent struggle with academic success that the model interprets as a warning sign. Finally, the absence of extra paid classes subtly nudges the prediction further toward failure, as the lack of additional support suggests fewer opportunities for improvement. The model predicts that the student is likely to fail the mathematics course, and this outcome is primarily shaped by several interconnected factors. Taken together, these elements interact to create a coherent story in which consistent academic challenges and limited support mechanisms drive the model's prediction that the student will not pass the course.",6,11.1,15.75,14.54,4.65,3.44,1.42,1.31,12.56,0.79,11.71,14.08,-4.0396,17.55,8.11,34.63,11.1,-6.2428,27.35,11.13,45.25,15.75,-4.7728,23.05,8.91,40.65,14.54
18,"At the outset, the model considered the student's performance in the second period, noting a grade of 6, which substantially decreased the likelihood of passing due to its strong negative influence. Building on this, the first period grade of 8 also contributed to a lower chance of success, albeit to a lesser extent. The student's history of two previous class failures further compounded this negative outlook, subtly reinforcing the model's expectation of a poor outcome. However, as the narrative unfolds, the student's age of 15 and the presence of extra educational support from the school emerged as modestly positive factors. These elements slightly counterbalanced the earlier negative influences, suggesting that while the student faces significant academic challenges, there are supportive mechanisms in place that could help improve their prospects. Ultimately, the interplay of these factors led the model to predict that the student is more likely to fail the mathematics course, primarily driven by their recent academic performance and history of failures, despite some mitigating support.","Ultimately, the interplay of these factors led the model to predict that the student is more likely to fail the mathematics course, primarily driven by their recent academic performance and history of failures, despite some mitigating support. These elements slightly counterbalanced the earlier negative influences, suggesting that while the student faces significant academic challenges, there are supportive mechanisms in place that could help improve their prospects. However, as the narrative unfolds, the student's age of 15 and the presence of extra educational support from the school emerged as modestly positive factors. The student's history of two previous class failures further compounded this negative outlook, subtly reinforcing the model's expectation of a poor outcome. Building on this, the first period grade of 8 also contributed to a lower chance of success, albeit to a lesser extent. At the outset, the model considered the student's performance in the second period, noting a grade of 6, which substantially decreased the likelihood of passing due to its strong negative influence.","However, as the narrative unfolds, the student's age of 15 and the presence of extra educational support from the school emerged as modestly positive factors. Building on this, the first period grade of 8 also contributed to a lower chance of success, albeit to a lesser extent. The student's history of two previous class failures further compounded this negative outlook, subtly reinforcing the model's expectation of a poor outcome. These elements slightly counterbalanced the earlier negative influences, suggesting that while the student faces significant academic challenges, there are supportive mechanisms in place that could help improve their prospects. At the outset, the model considered the student's performance in the second period, noting a grade of 6, which substantially decreased the likelihood of passing due to its strong negative influence. Ultimately, the interplay of these factors led the model to predict that the student is more likely to fail the mathematics course, primarily driven by their recent academic performance and history of failures, despite some mitigating support.",6,9.39,12.62,13.64,3.22,4.25,1.34,1.45,11.7,0.89,10.65,13.02,-5.0713,18.36,10.21,40.15,9.39,-2.6607,18.32,4.83,27.65,12.62,-5.2899,25.77,9.17,41.52,13.64
19,"The model predicts that the student will pass the mathematics course, primarily because of their strong academic performance throughout the year. At the outset, the student's impressive second period grade of 15 stands out as the most influential factor, substantially increasing the likelihood of passing. This positive momentum is further reinforced by a solid first period grade of 14, which continues to push the prediction toward success. As the narrative unfolds, the student's relatively low number of absences—just four—suggests consistent classroom engagement, subtly supporting the model's confidence in a favorable outcome. Additionally, the student's age of 15 aligns with typical expectations for this academic stage, providing a stable backdrop for learning. Finally, the infrequent outings with friends indicate a focus on studies rather than distractions, which, while less impactful than grades, still nudges the prediction in a positive direction. Altogether, these interconnected factors combine to explain why the model anticipates that the student will pass the course.","Altogether, these interconnected factors combine to explain why the model anticipates that the student will pass the course. Finally, the infrequent outings with friends indicate a focus on studies rather than distractions, which, while less impactful than grades, still nudges the prediction in a positive direction. Additionally, the student's age of 15 aligns with typical expectations for this academic stage, providing a stable backdrop for learning. As the narrative unfolds, the student's relatively low number of absences—just four—suggests consistent classroom engagement, subtly supporting the model's confidence in a favorable outcome. This positive momentum is further reinforced by a solid first period grade of 14, which continues to push the prediction toward success. At the outset, the student's impressive second period grade of 15 stands out as the most influential factor, substantially increasing the likelihood of passing. The model predicts that the student will pass the mathematics course, primarily because of their strong academic performance throughout the year.","At the outset, the student's impressive second period grade of 15 stands out as the most influential factor, substantially increasing the likelihood of passing. As the narrative unfolds, the student's relatively low number of absences—just four—suggests consistent classroom engagement, subtly supporting the model's confidence in a favorable outcome. Additionally, the student's age of 15 aligns with typical expectations for this academic stage, providing a stable backdrop for learning. This positive momentum is further reinforced by a solid first period grade of 14, which continues to push the prediction toward success. Altogether, these interconnected factors combine to explain why the model anticipates that the student will pass the course. The model predicts that the student will pass the mathematics course, primarily because of their strong academic performance throughout the year. Finally, the infrequent outings with friends indicate a focus on studies rather than distractions, which, while less impactful than grades, still nudges the prediction in a positive direction.",7,9.16,12.46,12.25,3.3,3.09,1.36,1.34,10.26,0.45,9.75,10.91,-3.1998,15.39,7.13,29.5,9.16,-4.3211,21.62,9.31,39.91,12.46,-6.2532,22.67,15.44,58.3,12.25
20,"The model predicts the student's likelihood of passing the mathematics course by weighing several key factors. At the outset, the student's second period grade emerges as the most influential element, as a relatively low score of 9 substantially decreases the probability of passing. This effect is compounded by the first period grade of 7, which further diminishes the predicted outcome. However, the narrative shifts slightly as the student's age of 15 introduces a modest positive influence, suggesting that being younger may offer a slight advantage. Additionally, the student's infrequent social outings with friends contribute a small but positive effect, implying that limited distractions outside of school could support academic success. Finally, the student's gender, identified as male, adds a minor positive contribution. Taken together, while certain factors such as age, social habits, and gender provide incremental support, the model's prediction is primarily shaped by the lower academic performance in the first two periods, ultimately leading to a reduced likelihood of passing the course.","Taken together, while certain factors such as age, social habits, and gender provide incremental support, the model's prediction is primarily shaped by the lower academic performance in the first two periods, ultimately leading to a reduced likelihood of passing the course. Finally, the student's gender, identified as male, adds a minor positive contribution. Additionally, the student's infrequent social outings with friends contribute a small but positive effect, implying that limited distractions outside of school could support academic success. However, the narrative shifts slightly as the student's age of 15 introduces a modest positive influence, suggesting that being younger may offer a slight advantage. This effect is compounded by the first period grade of 7, which further diminishes the predicted outcome. At the outset, the student's second period grade emerges as the most influential element, as a relatively low score of 9 substantially decreases the probability of passing. The model predicts the student's likelihood of passing the mathematics course by weighing several key factors.","At the outset, the student's second period grade emerges as the most influential element, as a relatively low score of 9 substantially decreases the probability of passing. However, the narrative shifts slightly as the student's age of 15 introduces a modest positive influence, suggesting that being younger may offer a slight advantage. Additionally, the student's infrequent social outings with friends contribute a small but positive effect, implying that limited distractions outside of school could support academic success. This effect is compounded by the first period grade of 7, which further diminishes the predicted outcome. Taken together, while certain factors such as age, social habits, and gender provide incremental support, the model's prediction is primarily shaped by the lower academic performance in the first two periods, ultimately leading to a reduced likelihood of passing the course. The model predicts the student's likelihood of passing the mathematics course by weighing several key factors. Finally, the student's gender, identified as male, adds a minor positive contribution.",7,8.94,13.38,12.85,4.44,3.91,1.5,1.44,10.59,0.62,9.68,11.39,-4.4728,18.13,10.02,39.05,8.94,-3.9364,21.45,8.43,38.1,13.38,-4.2724,20.47,10.29,44.08,12.85
