text_id_rev,num_sentences_rev,last_sentence_rev,ppl_rev
22,6,"At the outset, the model considered the student's academic performance, particularly focusing on their grades from the first and second periods.",15.18
23,1,"Taken together, these interconnected factors culminate in a strong expectation that the student will successfully pass the course.",30.67
23,2,"Meanwhile, the student's low number of absences and absence of prior class failures each contribute modestly to the prediction, indicating that regular attendance and a clean academic record subtly support the overall positive outlook.",24.24
23,3,"Although the student has expressed no particular desire to pursue higher education, this factor only slightly diminishes the probability of passing, suggesting that academic achievement can outweigh motivational factors in this context.",18.38
23,4,"This positive momentum is further reinforced by the first period grade of 14, which continues to elevate the prediction by demonstrating early competence.",19.2
23,5,"At the outset, the student's impressive second period grade of 12 exerts the most significant positive influence, signaling consistent mastery of the material and boosting the likelihood of passing.",16.27
23,6,"The model predicts that the student will pass the mathematics course, primarily because of their strong academic performance throughout the year.",14.61
24,1,"Altogether, these intertwined factors lead the model to its final prediction, with the student's recent academic achievements playing the most decisive role.",39.69
24,2,"Finally, the absence of any previous class failures adds a subtle positive effect, reinforcing the model's confidence in the student's ability to succeed.",23.14
24,3,"The student's age of 18 introduces a small negative influence, hinting that being older than typical classmates may slightly lower the predicted probability of passing.",17.55
24,4,"Meanwhile, the student's nine absences contribute a modest positive effect, indicating that, in this case, attendance did not detract from the overall prediction—perhaps because the student's grades compensate for missed days.",14.33
24,5,"Although the first period grade is also relatively high at 9, its impact is slightly negative, suggesting that the model places greater emphasis on recent academic improvement rather than earlier performance.",13.32
24,6,"At the heart of this prediction lies the student's strong performance in the second period, as reflected by a high grade of 10, which exerts the most significant positive influence and substantially boosts the chances of passing.",10.61
24,7,The model predicts the student's likelihood of passing the mathematics course by weighing several key factors from their academic record and personal background.,10.51
25,1,"Thus, the model’s prediction emerges from the interplay of these factors, ultimately concluding that the student is at high risk of failing the mathematics course.",24.57
25,2,"Nevertheless, these positive influences are not sufficient to counterbalance the substantial negative impact of the student’s grades and history of failures.",18.28
25,3,"The student’s participation in paid classes hints at an effort to improve, and being 16 years old may reflect a maturity that could aid learning.",18.47
25,4,"However, the narrative takes a slight turn with the presence of extra paid classes and the student’s age; both factors contribute modest positive effects.",18.07
25,5,"Additionally, the student’s record of two previous class failures amplifies the risk, as it suggests persistent academic challenges that the model interprets as barriers to success.",14.73
25,6,"This effect is compounded by the first period grade, which, being below average as well, further undermines the student’s chances by indicating a consistent pattern of underperformance throughout the year.",13.68
25,7,"At the outset, the student’s second period grade, which is relatively low, exerts the strongest negative influence, signaling that recent struggles in mathematics have significantly diminished the likelihood of passing.",12.67
25,8,"The model predicts that the student is likely to fail the mathematics course, and this outcome is primarily shaped by the student’s academic history and prior performance.",11.05
26,1,"Altogether, the combination of solid academic achievement and a lack of negative academic history leads the model to confidently anticipate that the student will pass.",39.08
26,2,"Although the student has a small number of absences and only goes out with friends infrequently, these factors play a comparatively minor role in shaping the prediction.",22.01
26,3,"Furthermore, the absence of prior class failures reinforces this positive trajectory, suggesting that the student has not struggled significantly in the past.",18.24
26,4,"Specifically, the student’s consistent grades of 12 in both periods signal a reliable academic foundation, which the model interprets as a key driver of success.",17.01
26,5,"The model predicts that the student will pass the mathematics course, primarily because their strong performance in both the first and second grading periods exerts a substantial positive influence on the outcome.",13.96
27,1,"Taken together, these factors interact to shape the model’s confident prediction that the student will pass.",54.81
27,2,"Finally, the student’s low frequency of going out with friends adds a modest positive influence, implying that a more focused social life may support academic achievement.",30.95
27,3,"Notably, the student has no recorded absences, which helps maintain their likelihood of passing, as consistent attendance is generally associated with better academic results.",19.57
27,4,"However, the student’s young age of 15 subtly contributes to a favorable outcome, suggesting that younger students in this context may have a slight advantage.",14.72
27,5,"This positive momentum is somewhat tempered by a lower first period grade of 8, which slightly detracts from the overall prediction.",14.15
27,6,"The model predicts that the student will pass the mathematics course, primarily because their strong performance in the second period, reflected by a high grade of 11, significantly boosts their chances of success.",11.47
28,1,"Taken together, these factors interact to create a favorable scenario, leading the model to predict that the student is likely to pass the mathematics course.",30.48
28,2,"Finally, the student's low frequency of going out with friends contributes a small positive influence, suggesting a focus on academics.",27.18
28,3,"Furthermore, the complete absence of school absences helps to prevent any detrimental effect on the outcome.",24.54
28,4,"The student's age also plays a modest but positive role, subtly enhancing the prediction.",21.52
28,5,"Although the first period grade is slightly lower and introduces a minor negative effect, its impact is overshadowed by the later improvement.",20.55
28,6,"At the heart of this prediction lies the student's strong performance in the second period, as reflected by a high grade, which exerts the most significant positive influence and substantially boosts the chances of passing.",14.19
28,7,The model predicts the student's likelihood of passing the mathematics course by weighing several key factors.,13.18
29,1,"Altogether, the interplay of these factors led the model to its final prediction, weaving together academic, personal, and social dimensions to reach its conclusion.",31.4
29,2,"Finally, the model took into account the student's perfect attendance, as indicated by zero absences, but this factor subtly decreased the probability of passing, possibly because, in the context of the other features, attendance alone was not enough to outweigh the influence of academic performance.",18.7
29,3,"Furthermore, the model recognized the student's excellent family relationships, which contributed positively, suggesting that strong familial support can bolster academic outcomes.",16.46
29,4,"As the model continued its assessment, it observed that the student's current health status was very bad, which, somewhat unexpectedly, nudged the prediction slightly upward, perhaps reflecting a compensatory mechanism in the model for students overcoming adversity.",14.38
29,5,"These grades exerted a downward pull on the prediction, signaling that while the student is performing adequately, these scores alone do not strongly indicate a likelihood of passing.",14.14
29,6,"At the outset, the model considered the student's academic performance, noting that both the first and second period grades were moderate, each scoring an 8.",13.37
