id,text,reversed_text,shuffled_text,num_sentences,ppl,ppl_reversed,ppl_shuffled,ppl_diff_reversed,ppl_diff_shuffled,ppl_ratio_reversed,ppl_ratio_shuffled,ppl_loo_mean,ppl_loo_std,ppl_loo_min,ppl_loo_max,ppl_cumulative_slope,ppl_cumulative_mean,ppl_cumulative_std,ppl_cumulative_first,ppl_cumulative_last,ppl_cumulative_rev_slope,ppl_cumulative_rev_mean,ppl_cumulative_rev_std,ppl_cumulative_rev_first,ppl_cumulative_rev_last,ppl_cumulative_shuff_slope,ppl_cumulative_shuff_mean,ppl_cumulative_shuff_std,ppl_cumulative_shuff_first,ppl_cumulative_shuff_last
7,"The model predicts that the student will pass the mathematics course, primarily because of their strong academic performance throughout the year. At the outset, the student’s impressive second period grade of 15 exerts the most significant positive influence, signaling consistent mastery of the material and boosting the likelihood of passing. This positive trend is further reinforced by the first period grade of 16, which adds additional confidence to the prediction by demonstrating early and sustained achievement. Although the student’s father works at home, this factor slightly diminishes the probability of passing, but its effect is minimal compared to the academic indicators. Moreover, the student’s perfect attendance and absence of prior class failures subtly support the prediction, as these factors suggest reliability and a lack of academic difficulties. Altogether, the model weaves these elements into a coherent assessment, concluding that the student’s strong grades and steady engagement are the driving forces behind the favorable prediction.","Altogether, the model weaves these elements into a coherent assessment, concluding that the student’s strong grades and steady engagement are the driving forces behind the favorable prediction. Moreover, the student’s perfect attendance and absence of prior class failures subtly support the prediction, as these factors suggest reliability and a lack of academic difficulties. Although the student’s father works at home, this factor slightly diminishes the probability of passing, but its effect is minimal compared to the academic indicators. This positive trend is further reinforced by the first period grade of 16, which adds additional confidence to the prediction by demonstrating early and sustained achievement. At the outset, the student’s impressive second period grade of 15 exerts the most significant positive influence, signaling consistent mastery of the material and boosting the likelihood of passing. The model predicts that the student will pass the mathematics course, primarily because of their strong academic performance throughout the year.","Although the student’s father works at home, this factor slightly diminishes the probability of passing, but its effect is minimal compared to the academic indicators. At the outset, the student’s impressive second period grade of 15 exerts the most significant positive influence, signaling consistent mastery of the material and boosting the likelihood of passing. This positive trend is further reinforced by the first period grade of 16, which adds additional confidence to the prediction by demonstrating early and sustained achievement. Moreover, the student’s perfect attendance and absence of prior class failures subtly support the prediction, as these factors suggest reliability and a lack of academic difficulties. The model predicts that the student will pass the mathematics course, primarily because of their strong academic performance throughout the year. Altogether, the model weaves these elements into a coherent assessment, concluding that the student’s strong grades and steady engagement are the driving forces behind the favorable prediction.",6,11.33,13.93,13.8,2.59,2.46,1.23,1.22,12.99,0.72,12.03,14.05,-3.7961,18.19,6.91,29.5,11.33,-5.15,22.88,10.01,43.59,13.93,-4.794,22.2,8.72,37.51,13.8
8,"The model predicts that the student will pass the mathematics course, primarily because their strong performance in both the first and second grading periods exerts the most significant positive influence on the outcome. Specifically, the student’s consistent grades of 14 in both periods serve as compelling evidence of their academic capability, each substantially boosting the likelihood of passing. Furthermore, the relatively low number of absences and the absence of any prior class failures further reinforce this positive outlook, as these factors suggest the student maintains regular attendance and has not struggled in the past. Finally, the student’s participation in extra paid classes, while contributing to a lesser extent, still adds a slight advantage. Altogether, these elements interact to create a robust case for the student’s success, with academic achievement and steady engagement emerging as the decisive forces behind the model’s prediction.","Altogether, these elements interact to create a robust case for the student’s success, with academic achievement and steady engagement emerging as the decisive forces behind the model’s prediction. Finally, the student’s participation in extra paid classes, while contributing to a lesser extent, still adds a slight advantage. Furthermore, the relatively low number of absences and the absence of any prior class failures further reinforce this positive outlook, as these factors suggest the student maintains regular attendance and has not struggled in the past. Specifically, the student’s consistent grades of 14 in both periods serve as compelling evidence of their academic capability, each substantially boosting the likelihood of passing. The model predicts that the student will pass the mathematics course, primarily because their strong performance in both the first and second grading periods exerts the most significant positive influence on the outcome.","Finally, the student’s participation in extra paid classes, while contributing to a lesser extent, still adds a slight advantage. Specifically, the student’s consistent grades of 14 in both periods serve as compelling evidence of their academic capability, each substantially boosting the likelihood of passing. Furthermore, the relatively low number of absences and the absence of any prior class failures further reinforce this positive outlook, as these factors suggest the student maintains regular attendance and has not struggled in the past. Altogether, these elements interact to create a robust case for the student’s success, with academic achievement and steady engagement emerging as the decisive forces behind the model’s prediction. The model predicts that the student will pass the mathematics course, primarily because their strong performance in both the first and second grading periods exerts the most significant positive influence on the outcome.",5,11.53,17.54,15.53,6.0,4.0,1.52,1.35,13.8,1.75,11.9,16.48,-3.3627,16.75,5.08,23.92,11.53,-6.6864,27.89,10.12,44.73,17.54,-13.4054,35.23,20.16,65.93,15.53
9,"At the outset, the model considered the student's academic performance across the first and second periods, noting that relatively low grades in both G1 and G2 exerted the strongest downward pressure on the likelihood of passing. As the analysis progressed, the model recognized that a higher number of absences slightly increased the risk of failure, though this effect was less pronounced than the impact of the grades. Nevertheless, the presence of extra paid classes and a clean record of no previous failures provided modest but positive influences, gently nudging the prediction toward a more favorable outcome. Ultimately, the interplay of these factors—where lower grades and frequent absences outweighed the benefits of additional support and a history free of failures—shaped the model’s conclusion regarding the student’s prospects in the mathematics course.","Ultimately, the interplay of these factors—where lower grades and frequent absences outweighed the benefits of additional support and a history free of failures—shaped the model’s conclusion regarding the student’s prospects in the mathematics course. Nevertheless, the presence of extra paid classes and a clean record of no previous failures provided modest but positive influences, gently nudging the prediction toward a more favorable outcome. As the analysis progressed, the model recognized that a higher number of absences slightly increased the risk of failure, though this effect was less pronounced than the impact of the grades. At the outset, the model considered the student's academic performance across the first and second periods, noting that relatively low grades in both G1 and G2 exerted the strongest downward pressure on the likelihood of passing.","Nevertheless, the presence of extra paid classes and a clean record of no previous failures provided modest but positive influences, gently nudging the prediction toward a more favorable outcome. As the analysis progressed, the model recognized that a higher number of absences slightly increased the risk of failure, though this effect was less pronounced than the impact of the grades. Ultimately, the interplay of these factors—where lower grades and frequent absences outweighed the benefits of additional support and a history free of failures—shaped the model’s conclusion regarding the student’s prospects in the mathematics course. At the outset, the model considered the student's academic performance across the first and second periods, noting that relatively low grades in both G1 and G2 exerted the strongest downward pressure on the likelihood of passing.",4,12.27,15.99,13.07,3.72,0.8,1.3,1.07,15.53,1.64,13.54,17.74,-4.5456,17.85,6.0,27.93,12.27,-10.421,28.17,12.08,46.58,15.99,-17.0704,28.96,22.38,67.26,13.07
10,"The model predicts that the student will pass the mathematics course, primarily because their strong performance in both the first and second grading periods exerts a substantial positive influence on the outcome. Specifically, the student's consistent grades of 14 in both periods signal a solid grasp of the material, which significantly boosts the likelihood of passing. Furthermore, the relatively low number of absences and the absence of any prior class failures further reinforce this positive trajectory, suggesting that the student maintains regular attendance and has not struggled with the subject in the past. Although the student's age plays a minor role, it does not meaningfully detract from the overall prediction. Taken together, these factors interact to create a compelling case for the student's success in the course, with academic achievement and steady engagement serving as the primary drivers behind the model's confident prediction.","Taken together, these factors interact to create a compelling case for the student's success in the course, with academic achievement and steady engagement serving as the primary drivers behind the model's confident prediction. Although the student's age plays a minor role, it does not meaningfully detract from the overall prediction. Furthermore, the relatively low number of absences and the absence of any prior class failures further reinforce this positive trajectory, suggesting that the student maintains regular attendance and has not struggled with the subject in the past. Specifically, the student's consistent grades of 14 in both periods signal a solid grasp of the material, which significantly boosts the likelihood of passing. The model predicts that the student will pass the mathematics course, primarily because their strong performance in both the first and second grading periods exerts a substantial positive influence on the outcome.","Although the student's age plays a minor role, it does not meaningfully detract from the overall prediction. Specifically, the student's consistent grades of 14 in both periods signal a solid grasp of the material, which significantly boosts the likelihood of passing. Furthermore, the relatively low number of absences and the absence of any prior class failures further reinforce this positive trajectory, suggesting that the student maintains regular attendance and has not struggled with the subject in the past. Taken together, these factors interact to create a compelling case for the student's success in the course, with academic achievement and steady engagement serving as the primary drivers behind the model's confident prediction. The model predicts that the student will pass the mathematics course, primarily because their strong performance in both the first and second grading periods exerts a substantial positive influence on the outcome.",5,8.4,11.77,9.94,3.37,1.54,1.4,1.18,9.9,0.76,9.13,11.17,-3.5671,13.44,5.37,22.65,8.4,-4.4971,17.73,7.42,31.94,11.77,-5.3632,17.44,8.09,30.54,9.94
11,"At the heart of the model’s prediction lies the student’s strong academic performance, as evidenced by high grades in both the first and second periods. The second period grade, in particular, exerts the most substantial positive influence, signaling consistent mastery of the material and suggesting a solid foundation for passing the course. This academic momentum is further reinforced by the first period grade, which also contributes meaningfully to the prediction, highlighting the student’s sustained effort over time. Meanwhile, the student’s very low frequency of social outings subtly supports the likelihood of passing, perhaps indicating a greater focus on studies. Additionally, the absence of any prior class failures and a minimal number of school absences both play a supportive role, each incrementally increasing the probability of success. Taken together, these factors interact to create a compelling narrative: the student’s strong grades, combined with steady attendance and a lack of academic setbacks, collectively drive the model’s confident prediction that the student will pass the mathematics course.","Taken together, these factors interact to create a compelling narrative: the student’s strong grades, combined with steady attendance and a lack of academic setbacks, collectively drive the model’s confident prediction that the student will pass the mathematics course. Additionally, the absence of any prior class failures and a minimal number of school absences both play a supportive role, each incrementally increasing the probability of success. Meanwhile, the student’s very low frequency of social outings subtly supports the likelihood of passing, perhaps indicating a greater focus on studies. This academic momentum is further reinforced by the first period grade, which also contributes meaningfully to the prediction, highlighting the student’s sustained effort over time. The second period grade, in particular, exerts the most substantial positive influence, signaling consistent mastery of the material and suggesting a solid foundation for passing the course. At the heart of the model’s prediction lies the student’s strong academic performance, as evidenced by high grades in both the first and second periods.","Meanwhile, the student’s very low frequency of social outings subtly supports the likelihood of passing, perhaps indicating a greater focus on studies. The second period grade, in particular, exerts the most substantial positive influence, signaling consistent mastery of the material and suggesting a solid foundation for passing the course. This academic momentum is further reinforced by the first period grade, which also contributes meaningfully to the prediction, highlighting the student’s sustained effort over time. Additionally, the absence of any prior class failures and a minimal number of school absences both play a supportive role, each incrementally increasing the probability of success. At the heart of the model’s prediction lies the student’s strong academic performance, as evidenced by high grades in both the first and second periods. Taken together, these factors interact to create a compelling narrative: the student’s strong grades, combined with steady attendance and a lack of academic setbacks, collectively drive the model’s confident prediction that the student will pass the mathematics course.",6,9.39,11.89,11.43,2.49,2.04,1.27,1.22,10.73,1.05,8.78,12.27,-2.5734,14.19,4.99,24.25,9.39,-3.1529,18.66,5.83,30.28,11.89,-19.7562,41.1,40.24,126.24,11.43
12,"The model predicts the student's likelihood of passing or failing the mathematics course by weighing several key factors. At the outset, the student's grades in both the first and second periods emerge as the most influential elements; both G1 and G2 are 9, and these relatively low scores exert a strong downward pull on the prediction, signaling a heightened risk of failure. This negative influence is further compounded by the student's history of academic setbacks, as having failed two classes in the past subtly reinforces the model's expectation of continued difficulty. Meanwhile, the student's age of 20, which is somewhat higher than typical for this context, also nudges the prediction toward a less favorable outcome, albeit to a lesser extent. However, the model does detect a slight mitigating effect from the fact that the student's parents live apart, which marginally increases the predicted chance of passing. Taken together, these intertwined factors lead the model to anticipate that the student is more likely to fail the mathematics course, with academic performance and prior failures serving as the primary drivers of this conclusion.","Taken together, these intertwined factors lead the model to anticipate that the student is more likely to fail the mathematics course, with academic performance and prior failures serving as the primary drivers of this conclusion. However, the model does detect a slight mitigating effect from the fact that the student's parents live apart, which marginally increases the predicted chance of passing. Meanwhile, the student's age of 20, which is somewhat higher than typical for this context, also nudges the prediction toward a less favorable outcome, albeit to a lesser extent. This negative influence is further compounded by the student's history of academic setbacks, as having failed two classes in the past subtly reinforces the model's expectation of continued difficulty. At the outset, the student's grades in both the first and second periods emerge as the most influential elements; both G1 and G2 are 9, and these relatively low scores exert a strong downward pull on the prediction, signaling a heightened risk of failure. The model predicts the student's likelihood of passing or failing the mathematics course by weighing several key factors.","Meanwhile, the student's age of 20, which is somewhat higher than typical for this context, also nudges the prediction toward a less favorable outcome, albeit to a lesser extent. At the outset, the student's grades in both the first and second periods emerge as the most influential elements; both G1 and G2 are 9, and these relatively low scores exert a strong downward pull on the prediction, signaling a heightened risk of failure. This negative influence is further compounded by the student's history of academic setbacks, as having failed two classes in the past subtly reinforces the model's expectation of continued difficulty. However, the model does detect a slight mitigating effect from the fact that the student's parents live apart, which marginally increases the predicted chance of passing. The model predicts the student's likelihood of passing or failing the mathematics course by weighing several key factors. Taken together, these intertwined factors lead the model to anticipate that the student is more likely to fail the mathematics course, with academic performance and prior failures serving as the primary drivers of this conclusion.",6,8.89,11.4,11.67,2.51,2.78,1.28,1.31,10.09,0.32,9.47,10.48,-3.9547,15.93,7.35,30.5,8.89,-3.3861,16.56,6.85,30.92,11.4,-2.9522,17.17,5.61,28.62,11.67
13,"The model predicts the student's likelihood of passing the mathematics course by weighing several key factors. At the outset, the student's relatively low grades in both the first and second periods emerge as the most influential elements, each exerting a substantial negative impact on the prediction. Specifically, the second period grade of 9 and the first period grade of 8 both diminish the probability of passing, signaling that consistent academic struggles have shaped the model's outlook. As the narrative unfolds, the student's age of 19 further nudges the prediction downward, albeit to a lesser extent, suggesting that being older than typical classmates may correlate with additional challenges. However, the story takes a slight turn as the presence of extra paid classes and the student's male gender each contribute modest positive effects, hinting at potential support mechanisms and demographic tendencies that could improve the outcome. Ultimately, despite these small positive influences, the dominant effect of the low academic performance leads the model to anticipate that the student is at risk of not passing the course.","Ultimately, despite these small positive influences, the dominant effect of the low academic performance leads the model to anticipate that the student is at risk of not passing the course. However, the story takes a slight turn as the presence of extra paid classes and the student's male gender each contribute modest positive effects, hinting at potential support mechanisms and demographic tendencies that could improve the outcome. As the narrative unfolds, the student's age of 19 further nudges the prediction downward, albeit to a lesser extent, suggesting that being older than typical classmates may correlate with additional challenges. Specifically, the second period grade of 9 and the first period grade of 8 both diminish the probability of passing, signaling that consistent academic struggles have shaped the model's outlook. At the outset, the student's relatively low grades in both the first and second periods emerge as the most influential elements, each exerting a substantial negative impact on the prediction. The model predicts the student's likelihood of passing the mathematics course by weighing several key factors.","As the narrative unfolds, the student's age of 19 further nudges the prediction downward, albeit to a lesser extent, suggesting that being older than typical classmates may correlate with additional challenges. At the outset, the student's relatively low grades in both the first and second periods emerge as the most influential elements, each exerting a substantial negative impact on the prediction. Specifically, the second period grade of 9 and the first period grade of 8 both diminish the probability of passing, signaling that consistent academic struggles have shaped the model's outlook. However, the story takes a slight turn as the presence of extra paid classes and the student's male gender each contribute modest positive effects, hinting at potential support mechanisms and demographic tendencies that could improve the outcome. The model predicts the student's likelihood of passing the mathematics course by weighing several key factors. Ultimately, despite these small positive influences, the dominant effect of the low academic performance leads the model to anticipate that the student is at risk of not passing the course.",6,9.83,14.02,12.69,4.18,2.86,1.43,1.29,11.26,0.64,10.44,12.43,-5.0805,18.29,9.95,39.05,9.83,-4.8155,22.5,8.71,38.32,14.02,-6.8404,23.39,14.23,54.0,12.69
