text_id,num_sentences,last_sentence,ppl
23,3,"Their body mass index is somewhat elevated at 29.9, but this alone did not tip the balance, especially since their average glucose level is actually lower than the typical value seen in the data, suggesting good blood sugar control.",10.58
23,4,"The absence of hypertension, a well-known risk factor for stroke, further reassured the model that the patient’s overall risk remains low.",8.9
23,5,"Finally, while gender was considered, it did not play a significant role in this particular prediction, allowing the other health and lifestyle factors to drive the outcome.",8.57
24,1,"For this patient, the model predicted that they are not at risk of having a stroke, and the most influential factor in this decision was their young age of 23, which is well below the average age in the dataset and strongly associated with lower stroke risk.",13.35
24,2,"This protective effect of youth was further supported by the patient’s healthy body mass index, which, being close to the average, did not raise any additional concerns.",11.07
24,3,"The patient’s average glucose level was also notably lower than what is typically observed, suggesting good metabolic health and further reducing the likelihood of stroke.",9.53
24,4,"Additionally, the absence of hypertension—a known risk factor for stroke—helped reinforce the model’s confidence in its prediction.",7.98
24,5,"Finally, while the patient’s gender was considered, it did not meaningfully sway the outcome, leaving the other health and lifestyle factors as the primary reasons for the reassuring result.",8.1
25,1,"For this patient, the model predicted that they are not at risk of having a stroke, and this decision was shaped most strongly by their age.",25.23
25,2,"Although the patient is slightly older than the average in the dataset, their age still falls within a range that typically carries lower risk, which helped steer the prediction away from stroke.",14.24
25,3,"The next most influential factor was the patient’s average glucose level, which, while higher than average, did not reach a threshold that would significantly elevate stroke risk on its own—especially when considered alongside other features.",9.63
25,4,"The patient’s body mass index is above average, which could have nudged the risk higher, but this effect was outweighed by the protective influence of their age and the absence of hypertension, a condition known to sharply increase stroke risk.",8.19
25,5,"Finally, the patient’s gender did not play a meaningful role in this prediction, so the model’s outcome was primarily driven by the interplay of age, glucose, BMI, and hypertension status, ultimately leading to a reassuring result.",7.02
26,1,"The model predicted that this patient is not at risk of having a stroke, and the most influential factor in this decision was the patient’s young age of 9 years, which is far below the average age in the dataset and strongly reduces stroke risk.",15.44
26,2,"This protective effect is further supported by the patient’s average glucose level, which, being slightly lower than the typical value, suggests stable blood sugar and less likelihood of metabolic complications that could contribute to stroke.",12.83
26,3,"The patient’s body mass index is just above average, but not high enough to outweigh the benefits of youth and healthy glucose levels, so it does not significantly increase risk in this context.",9.83
26,4,"Additionally, the absence of hypertension—a known major risk factor for stroke—further reassures the model that the patient’s overall health profile is favorable.",8.55
26,5,"Finally, while the patient’s gender is noted, it did not play a meaningful role in the prediction, so the model’s confidence rests primarily on the combination of youth, healthy glucose, and lack of hypertension, all of which point toward a low risk of stroke.",7.32
27,1,"For this patient, the model predicted that they are not at risk of having a stroke, and the reasoning begins with their age, which stands out as the most influential factor.",21.87
27,2,"Being only 28 years old, well below the average age in the dataset, significantly reduces their risk, as younger individuals are generally less likely to experience strokes due to the cumulative nature of vascular risk factors over time.",10.54
27,3,"Their average glucose level is also slightly below the typical value, which further supports a lower risk, since elevated glucose is often linked to vascular complications.",9.49
27,4,"Although their body mass index is higher than average, which could have increased their risk, this effect is outweighed by the protective influence of their youth and healthy glucose levels.",7.77
27,5,"Additionally, the absence of hypertension and the patient's gender did not meaningfully sway the prediction, leaving age and metabolic health as the primary reasons the model confidently assessed a low stroke risk for this individual.",7.95
28,1,"For this patient, the model predicted that they are not at risk of having a stroke, and the most influential factor in this decision was their age, which, while higher than average, actually reduced the predicted risk—possibly because other risk factors did not align with what is typically seen in higher-risk older patients.",15.15
28,2,"The patient’s average glucose level, which is slightly below the population average, also played a role in lowering the risk, as well-controlled blood sugar is generally associated with better vascular health.",11.96
28,3,"However, the patient’s body mass index is notably above average, and the presence of hypertension would usually raise concern, but in this case, their impact was outweighed by the more protective factors.",10.35
28,4,"The model also considered the patient’s gender, but this did not meaningfully influence the outcome.",9.18
28,5,"Altogether, the combination of a relatively healthy glucose level and the specific context of the patient’s age led the model to conclude that the risk of stroke is low, despite some less favorable health indicators.",8.31
29,1,"The model predicted that this patient is at risk of having a stroke, and the story begins with age playing a leading role: at 54 years old, the patient is notably older than the average in the dataset, which is a well-known risk factor for stroke as blood vessels become more vulnerable over time.",16.12
29,2,"Next, the patient’s body mass index (BMI) is higher than average, suggesting a tendency toward overweight, which can contribute to cardiovascular strain and further elevate stroke risk.",10.65
29,3,"Interestingly, the patient’s average glucose level is actually lower than the typical value seen in the dataset, which might have slightly reduced the predicted risk, since high blood sugar is often linked to vascular problems.",9.26
29,4,"The absence of hypertension, a condition that usually increases stroke risk, also worked in the patient’s favor, but its influence was relatively minor compared to age and BMI.",8.1
29,5,"Finally, the patient’s gender did not meaningfully sway the prediction, so the model’s decision was primarily shaped by the interplay of age and BMI, with the mitigating effects of healthy blood pressure and glucose levels not quite strong enough to offset the overall risk.",7.58
