text_id,num_sentences,last_sentence,ppl
0,1,"The model predicted that this patient is at risk of having a stroke, and the story begins with age playing a decisive role: at 78 years old, the patient is much older than the typical individual in the dataset, and advanced age is widely recognized as a major risk factor for stroke due to the cumulative effects of vascular changes over time.",13.39
0,2,"While the patient’s average glucose level is only slightly above the dataset average, this factor did not significantly sway the prediction, perhaps because it remains within a relatively healthy range and does not indicate diabetes or severe metabolic issues.",11.85
0,3,"Similarly, the patient’s body mass index is actually lower than average, suggesting that weight is not contributing to increased risk in this case, and may even offer some protective effect.",9.77
0,4,"The absence of hypertension, a common driver of stroke risk, further complicates the picture, as one might expect this to lower the overall risk, but its influence was minimal compared to the overwhelming impact of age.",9.06
0,5,"Ultimately, the model’s decision hinges on the understanding that, despite some favorable health indicators, the patient’s advanced age alone substantially elevates the likelihood of stroke, overshadowing the more modest effects of other health and lifestyle factors.",8.21
1,1,"For this patient, the model predicted that they are not at risk of having a stroke, and this decision was shaped most strongly by their age.",25.23
1,2,"Although the patient is 51 years old—significantly older than the average in the dataset—age alone did not push the risk high enough, perhaps because other factors counterbalanced its effect.",14.22
1,3,"Their average glucose level, while slightly above the dataset average, remained within a range that typically does not signal immediate danger, especially when considered alongside the absence of hypertension, a condition known to sharply increase stroke risk.",12.53
1,4,"The patient’s body mass index is elevated, which could have raised concern, but without additional risk factors such as high blood pressure, its impact was lessened.",10.61
1,5,"Finally, the patient’s gender did not meaningfully sway the prediction, so the model ultimately concluded that, despite some elevated health indicators, the overall risk of stroke for this individual remains low.",9.18
2,1,"For this patient, the model predicted that they are not at risk of having a stroke, and the reasoning begins with their age, which, while slightly above the average in the dataset, is still within a range where stroke risk is generally lower compared to older adults.",14.97
2,2,"The patient’s average glucose level closely matches the typical value seen in the population, suggesting stable blood sugar control, which is important since elevated glucose can increase stroke risk.",11.85
2,3,"Although their body mass index is higher than average, indicating they are in the obese range, this factor alone did not outweigh the protective effects of other features.",9.94
2,4,"The absence of hypertension, a major risk factor for stroke, further reassured the model that the patient’s overall risk remains low.",8.26
2,5,"Finally, the patient’s gender did not play a significant role in shifting the prediction, so the model’s decision was primarily shaped by the interplay of age, glucose, BMI, and hypertension status, ultimately leading to a low predicted risk of stroke.",6.82
3,1,"For this patient, the model predicted that they are not at risk of having a stroke, and this decision was shaped most strongly by their age.",25.23
3,2,"Although the patient is 52 years old—significantly older than the average in the dataset—the model recognized that age alone does not determine stroke risk, especially when other factors are considered.",12.38
3,3,"Their average glucose level is somewhat higher than typical, but not alarmingly so, and this moderate elevation did not outweigh other protective factors.",11.82
3,4,"Interestingly, while the patient’s body mass index is above average, the absence of hypertension—a well-known risk factor for stroke—helped tip the balance toward a lower risk prediction.",9.33
3,5,"Taken together, these interconnected health and lifestyle details led the model to conclude that, despite some elevated values, the overall risk profile for this patient does not indicate a likely stroke.",9.09
4,1,"For this patient, the model predicted a heightened risk of stroke, and the story begins with age playing a central role: at 64 years old, the patient is significantly older than the average in the dataset, and advanced age is widely recognized as a major risk factor for stroke due to cumulative vascular changes over time.",15.46
4,2,"While the patient’s average glucose level is quite close to the typical value and does not stand out as a risk driver, the slightly elevated body mass index suggests a tendency toward overweight, which can contribute to cardiovascular strain and thus subtly nudge the risk upward.",12.45
4,3,"Interestingly, the absence of hypertension, a condition often linked to stroke, acts as a small protective factor in this case, but its influence is outweighed by the patient’s age and BMI.",9.4
4,4,"The patient’s gender, being male, does not appear to have a notable effect in this prediction, as the model found it less informative for distinguishing stroke risk in this context.",9.0
4,5,"Altogether, the model’s decision is shaped most strongly by the patient’s advanced age, with BMI providing additional context, ultimately leading to the conclusion that this individual faces an elevated risk of stroke despite some neutral or protective health factors.",8.64
5,1,"The model predicted that this patient is not at risk of having a stroke, and the most influential factor in this decision was the patient’s young age of 8 years, which is far below the average age in the dataset and strongly associated with a lower likelihood of stroke.",12.17
5,2,"This protective effect is further reinforced by the patient’s low body mass index of 18.4, which suggests a healthy weight for their age and reduces the risk of cardiovascular complications.",8.44
5,3,"Additionally, the patient’s average glucose level is 65.32, which is well below the typical adult average and indicates no signs of elevated blood sugar that might otherwise increase stroke risk.",8.45
5,4,"The absence of hypertension, a major contributor to stroke in adults, also played a small but supportive role in the model’s assessment.",8.02
5,5,"Finally, while the patient’s gender was considered, it did not meaningfully influence the outcome, and together these factors led the model to confidently predict a low risk of stroke for this individual.",7.16
6,1,"For this patient, the model predicted that they are not at risk of having a stroke, and the story behind this decision begins with their age.",23.94
6,2,"Being only 9 years old, the patient is far younger than the typical age group where stroke risk becomes significant, which strongly steered the prediction away from stroke.",14.69
6,3,"This low risk is further reinforced by the patient’s body mass index (BMI) of 16.3, which is well below the average and suggests a healthy weight, reducing the likelihood of related health complications.",8.69
6,4,"Additionally, the patient’s average glucose level is 66.11, a value that sits comfortably below the population average and indicates no signs of elevated blood sugar, a known risk factor for stroke.",7.88
6,5,"The absence of hypertension, a major contributor to stroke risk, further supports the model’s conclusion, while the patient’s gender did not play a meaningful role in shaping the outcome for this particular case.",7.31
7,1,"For this patient, the model predicted that they are not at risk of having a stroke, and the story begins with their age, which stands out as the most influential factor.",22.89
7,2,"Being just 17 years old, the patient is much younger than the typical age associated with higher stroke risk, and this youthfulness strongly steers the prediction away from danger.",14.12
7,3,"Their body mass index is also notably low, suggesting a healthy weight that further reduces the likelihood of stroke, especially when compared to the average in the dataset.",10.2
7,4,"The patient’s average glucose level is well within a normal range, which is important because elevated glucose can signal underlying metabolic issues that increase stroke risk.",8.96
7,5,"Finally, the absence of hypertension and the patient’s gender did not meaningfully sway the prediction, so the model’s confidence in a low stroke risk is anchored primarily in the patient’s youth, healthy weight, and stable glucose levels, all of which are well-established protective factors in medical research.",7.75
8,1,"The model predicted that this patient is at risk of having a stroke, and the primary reason lies in her age: at 70 years old, she is significantly older than the average patient, which is a well-known risk factor for stroke due to the cumulative effects of aging on blood vessels and the brain.",9.23
8,2,"While her average glucose level is actually lower than typical, which might have offered some protection, this factor did not weigh heavily in the model’s decision.",10.4
8,3,"Her body mass index stands out as notably high, suggesting obesity, which is often linked to increased stroke risk through its association with conditions like atherosclerosis and metabolic syndrome.",9.35
8,4,"Interestingly, the absence of hypertension, a common contributor to stroke, did not offset the risk in this case, likely because the impact of age and BMI was so pronounced.",8.27
8,5,"Finally, her gender did not play a significant role in the prediction, so the model’s decision was driven mainly by the interplay between her advanced age and elevated BMI, both of which are powerful indicators of stroke risk in medical research.",7.21
9,1,"For this patient, the model predicted that they are not at risk of having a stroke, and the reasoning begins with their age, which stands out as the most influential factor.",21.87
9,2,"Being only 8 years old, this patient is far younger than the typical adult in the dataset, and since stroke risk rises sharply with age, their youth strongly protects them.",13.13
9,3,"Their body mass index is also notably low at 16.1, which, compared to the average, suggests a healthy weight for a child and further reduces cardiovascular risk.",11.19
9,4,"Although their average glucose level is somewhat elevated at 118.66, this alone is not enough to outweigh the protective effects of their age and BMI, especially in the absence of hypertension.",9.4
9,5,"Finally, the fact that the patient does not have hypertension, a major risk factor for stroke, reinforces the model’s confidence in predicting a low risk, illustrating how these features together create a reassuring health profile for this young individual.",8.23
10,1,"The model predicted that this patient is not at risk of having a stroke, and the story begins with their age, which stands out as the most influential factor.",31.6
10,2,"Being only six years old, the patient is far younger than the typical age associated with higher stroke risk, so this youthful profile strongly steers the prediction away from danger.",21.24
10,3,"Next, the patient’s body mass index is notably lower than average, suggesting a healthy weight that further reduces the likelihood of stroke, since higher BMI is often linked to cardiovascular problems.",12.73
10,4,"Their average glucose level is also well below the population mean, indicating stable blood sugar and lessening concerns about diabetes-related complications.",11.92
10,5,"Finally, the absence of hypertension, a major contributor to stroke in adults, reinforces the model’s confidence that this patient’s current health and lifestyle factors collectively point toward a low risk of stroke.",9.85
11,1,"For this patient, the model predicted that they are not at risk of having a stroke, and this decision was shaped most strongly by their age.",25.23
11,2,"Although the patient is 53 years old—significantly older than the average in the dataset—age actually reduced their predicted risk, possibly because other risk factors were not present or were well-controlled.",14.45
11,3,"Their average glucose level was only slightly above the typical value, which did little to increase their risk, suggesting stable blood sugar management.",14.19
11,4,"While their BMI was higher than average, indicating they are in the overweight range, this factor alone was not enough to outweigh the protective effects of other features, especially since the patient does not have hypertension—a major risk factor for stroke that is absent here.",10.56
11,5,"Taken together, these elements combined to reassure the model that, despite some elevated values, the overall profile did not signal a high likelihood of stroke for this individual.",9.95
12,1,"For this patient, the model predicted that they are not at risk of having a stroke, and this decision was shaped most strongly by their age.",25.23
12,2,"Although the patient is 41 years old, which is slightly above the average in the dataset, the model appears to weigh younger ages as protective, likely because stroke risk tends to rise more sharply in older populations.",14.71
12,3,"Their average glucose level is only a little higher than the typical value, and this small difference did not push the risk higher, perhaps because glucose levels in this range are not usually associated with acute stroke risk unless combined with other factors.",12.25
12,4,"Interestingly, the patient’s body mass index is quite elevated, which could have increased their risk, but the absence of hypertension—a key medical risk factor—seems to have counterbalanced this concern.",10.93
12,5,"Finally, the patient’s gender did not play a significant role in the model’s decision, suggesting that, for this individual, age and the lack of hypertension were the most decisive factors in predicting a low risk of stroke.",8.69
13,1,"For this patient, the model predicted that they are not at risk of having a stroke, and the story begins with their age, which stands out as the most influential factor.",22.89
13,2,"Being only 9 years old, the patient is far younger than the typical age associated with higher stroke risk, and this youthful profile strongly steers the prediction away from danger.",15.14
13,3,"Their body mass index is also notably lower than average, suggesting a healthy weight that further reduces the likelihood of stroke, since excess weight is a well-known risk factor.",10.1
13,4,"In addition, the patient’s average glucose level is below the population norm, which likely signals good metabolic health and lessens concerns about diabetes-related complications.",9.62
13,5,"Finally, the absence of hypertension and the patient’s gender did not meaningfully sway the model’s decision, so the combination of youth, healthy weight, and stable glucose levels collectively led the model to confidently predict a low risk of stroke for this individual.",8.17
14,1,"For this patient, the model predicted that they are not at risk of having a stroke, and the most influential factor in this decision was their age, which, at 39, is only slightly above the average in the dataset and generally considered a lower-risk group for stroke compared to older adults.",14.23
14,2,"Although their average glucose level is notably lower than the typical value seen in the data, which often signals a healthier metabolic profile and further reduces stroke risk, their body mass index is somewhat elevated, suggesting a potential concern.",12.8
14,3,"However, the absence of hypertension—a well-known risk factor for stroke—helped to counterbalance the effect of a higher BMI.",10.75
14,4,"The patient's gender, being female, did not sway the prediction in either direction, as the model found it to have little impact in this context.",9.34
14,5,"Altogether, the combination of relatively young age, low glucose levels, and no hypertension led the model to conclude that this patient is unlikely to experience a stroke, despite some risk factors present.",7.47
15,1,"For this patient, the model predicted that they are not at risk of having a stroke, and this decision was shaped most strongly by their age.",25.23
15,2,"Although the patient is 46 years old, which is notably higher than the average in the dataset, the model appears to weigh this factor as reducing the likelihood of stroke in the context of the other features—perhaps because, in this dataset, age alone does not always signal elevated risk without other compounding factors.",14.45
15,3,"The patient's body mass index is somewhat above average, but this did not significantly sway the prediction, suggesting that BMI on its own was not a decisive risk factor here.",11.69
15,4,"Similarly, while their average glucose level is higher than typical, the model did not interpret this as a strong indicator of stroke risk, possibly because the absence of hypertension—a known major risk factor—helped counterbalance these other values.",10.32
15,5,"Altogether, the combination of these health and lifestyle factors led the model to conclude that this patient is not predicted to have a stroke, highlighting how the interplay between features can sometimes override the influence of any single risk factor.",9.12
16,1,"For this patient, the model predicted that they are not at risk of having a stroke, and this outcome is shaped most strongly by their age, which is just below the average for the dataset.",18.81
16,2,"Since younger age is generally associated with a lower risk of stroke, this factor played a significant role in steering the prediction away from a positive stroke risk.",12.33
16,3,"Although the patient’s average glucose level is slightly higher than the typical value, it did not weigh heavily enough to offset the protective effect of their age, especially when considered alongside their healthy body mass index, which is also below the dataset average and suggests a lower likelihood of metabolic complications.",8.85
16,4,"The absence of hypertension further supports the model’s decision, as high blood pressure is a well-known risk factor for stroke, and its absence here reduces concern.",7.48
16,5,"Finally, while the patient’s gender was included in the analysis, it did not meaningfully influence the prediction, allowing the other health and lifestyle factors to take precedence in the model’s assessment.",7.1
17,1,"For this patient, the model predicted that they are not at risk of having a stroke, and the reasoning unfolds as follows.",33.34
17,2,"The most influential factor was the patient’s age, which, being higher than average, would typically raise concern, since stroke risk increases with age; however, this effect was outweighed by other protective elements in their profile.",16.02
17,3,"Notably, the patient’s body mass index was slightly above average, but this did not significantly sway the prediction, perhaps because moderate elevations in BMI alone are not always decisive without other risk factors.",12.57
17,4,"The patient’s average glucose level was much lower than what is typically seen, which likely signaled good metabolic health and helped reduce the overall risk.",12.0
17,5,"Additionally, the absence of hypertension—a major contributor to stroke—further reassured the model, and the patient’s gender did not meaningfully alter the outcome, leading to a confident prediction that this individual is not likely to experience a stroke.",9.4
18,1,"For this patient, the model predicted that they are not at risk of having a stroke, and the story begins with their age, which stands out as the most influential factor.",22.89
18,2,"Being only five years old, the patient is far younger than the typical age associated with higher stroke risk, and this youthfulness strongly steers the prediction away from danger.",15.43
18,3,"Their body mass index, while slightly below the average, also contributes to a lower risk, as children with lower BMI are less likely to have the chronic conditions that often lead to strokes later in life.",10.55
18,4,"Although the patient’s average glucose level is higher than what is commonly seen, the absence of hypertension—a key medical risk factor—helps to counterbalance this concern, suggesting that the elevated glucose may not yet have led to vascular complications.",9.44
18,5,"Finally, the patient’s gender did not play a significant role in the model’s decision, so the overall picture is one of a young, generally healthy individual whose age and lack of hypertension are the main reasons the model confidently predicts no imminent risk of stroke.",8.11
19,1,"For this patient, the model predicted that they are not at risk of having a stroke, and the reasoning begins with their age, which stands out as the most influential factor.",21.87
19,2,"Being only five years old, the patient is far younger than the typical age associated with higher stroke risk, and this youthful profile strongly steers the prediction away from danger.",15.31
19,3,"Their body mass index is also notably low compared to the average, which further reduces concern, as lower BMI in children is rarely linked to stroke.",12.47
19,4,"The patient’s average glucose level, while slightly above the dataset average, remains within a healthy range and does not raise any red flags in the context of their other health indicators.",10.57
19,5,"Finally, the absence of hypertension and the patient’s gender did not meaningfully sway the model’s decision, so the combination of youth and healthy body metrics ultimately led the model to predict a low risk of stroke for this individual.",9.21
20,1,"The model predicted that this patient is at risk of having a stroke, and the story begins with age playing a central role: at 68 years old, the patient is much older than the typical individual in the dataset, and advanced age is widely recognized as a major risk factor for stroke due to the cumulative effects of vascular changes over time.",13.1
20,2,"While the patient’s average glucose level is slightly below the dataset average, this factor did not significantly sway the prediction, suggesting that blood sugar control is not a primary concern in this case.",10.73
20,3,"Similarly, the patient’s body mass index is just above average, but this modest difference did not meaningfully increase risk, perhaps because it falls within a range that is not strongly associated with stroke in the context of the other features.",8.91
20,4,"Interestingly, the absence of hypertension, a condition often linked to stroke, did not reduce the predicted risk, likely because the patient’s advanced age outweighed the protective effect of normal blood pressure.",7.51
20,5,"Altogether, the model’s decision was driven most strongly by the patient’s age, with other health and lifestyle factors playing only minor roles, highlighting how age can dominate stroke risk assessments even when other indicators are relatively unremarkable.",7.22
21,1,"The model predicted that this patient is at risk of having a stroke, and the story begins with age playing a decisive role: at 79 years old, the patient is much older than the average in the dataset, and advanced age is widely recognized as a major risk factor for stroke due to the cumulative effects of vascular changes over time.",13.22
21,2,"While the patient’s average glucose level is only slightly above the typical value, this factor did not significantly sway the prediction, suggesting that blood sugar control is not a primary concern in this case.",11.01
21,3,"The presence of hypertension, however, adds another layer of risk, as high blood pressure is a well-established contributor to stroke by increasing strain on blood vessels.",8.36
21,4,"The patient’s body mass index is somewhat higher than average, which may further elevate risk, since excess weight can exacerbate both hypertension and other cardiovascular issues.",7.69
21,5,"Finally, the patient’s gender did not meaningfully influence the model’s decision, indicating that the other health and lifestyle factors were far more decisive in shaping the prediction.",7.61
22,1,"For this patient, the model predicted that they are not at risk of having a stroke, and the most influential factor in this decision was their young age of 8 years, which is far below the typical age where stroke risk becomes significant.",15.15
22,2,"This low age, combined with a body mass index (BMI) of 14.6—well under the average for the population—further reduced the likelihood of stroke, as both youth and a healthy BMI are generally protective against cardiovascular events.",10.0
22,3,"Although the patient’s average glucose level is slightly above the population mean, it remains within a range that is not typically associated with high stroke risk, especially in the absence of other risk factors.",8.06
22,4,"The absence of hypertension, a major contributor to stroke in adults, also played a small but reassuring role in the model’s assessment.",7.78
22,5,"Finally, while the patient’s gender was considered, it did not meaningfully influence the prediction, and thus the model’s decision was driven primarily by the patient’s age and overall healthy profile.",7.17
23,1,"For this patient, the model predicted that they are not at risk of having a stroke, and this decision was shaped most strongly by their age.",25.23
23,2,"Although the patient is 53 years old, which is higher than the average in the dataset, the model appears to have weighed this factor less heavily, possibly because other risk indicators were not present.",12.77
