text_id,sentence_index,removed_sentence,ppl_without_sentence,original_ppl,ppl_change
0,0,The model predicted that this individual is not likely to be rearrested within the next two years.,14.55,12.09,2.46
0,1,"The most influential factor in this assessment was the person’s young age of 21, which, despite being lower than the average, actually reduced the estimated risk—possibly because younger individuals with no prior record may be seen as less entrenched in criminal behavior.",14.32,12.09,2.23
0,2,"Supporting this, the individual has no prior crimes, a strong protective factor compared to the typical history of several offenses in the dataset.",11.48,12.09,-0.61
0,3,"Although the person has previously recidivated, this was outweighed by the lack of prior crimes and the relatively short time—just four months—spent in jail, which is much less than most others and may indicate a less severe criminal history.",13.7,12.09,1.61
0,4,"Finally, while being recorded as Black is a demographic detail the model considered, it played a smaller role compared to the other factors, and the overall combination of features led to a low predicted risk of recidivism.",13.57,12.09,1.48
1,0,The model predicted that this individual is at risk of being rearrested within two years.,9.99,8.95,1.04
1,1,"The most influential factor in this prediction was the individual's race, with the model noting that they are not recorded as Black, a detail that, based on historical data, tends to slightly lower risk estimates—though this may reflect broader systemic biases in the data.",8.82,8.95,-0.13
1,2,"The next most important feature was whether the person had previously recidivated, and in this case, they had not, which would typically reduce the predicted risk, as prior recidivism is a strong indicator of future behavior.",10.67,8.95,1.72
1,3,"Age also played a role, with the individual being 34 years old, which is close to the average in the dataset; research often shows that recidivism risk is higher for younger individuals, so age here may have had a neutral or slightly protective effect.",10.86,8.95,1.91
1,4,"Interestingly, despite having spent only one month in jail—much less than the average—the individual has five prior crimes, which is above average and may have ultimately tipped the balance toward a higher risk prediction, as a greater number of prior offenses is often associated with increased likelihood of reoffending.",9.75,8.95,0.8
2,0,The model predicted that this individual is at risk of being rearrested within two years.,10.32,9.79,0.52
2,1,"The most influential factor in this prediction was that the person has not previously recidivated, which would typically lower their risk, but other aspects outweighed this protective effect.",10.29,9.79,0.49
2,2,"Notably, the individual has only two prior crimes, which is below the average in the dataset and might have been expected to reduce their risk, yet the model still flagged them as high risk.",11.73,9.79,1.94
2,3,"Their age, at 34, is close to the average and does not strongly sway the prediction, but being recorded as Black—despite the model assigning a negative influence to this feature—reflects broader systemic patterns that can affect risk assessments in complex ways.",9.32,9.79,-0.47
2,4,"Finally, the fact that they have not spent any time in jail, compared to an average of over 20 months, might suggest less exposure to environments that can reinforce criminal behavior, but in this case, the combination of all these factors led the model to predict a higher likelihood of recidivism.",12.96,9.79,3.17
3,0,The model predicted that this individual is not likely to be rearrested within the next two years.,10.12,9.29,0.83
3,1,"The most influential factor in this decision was the unusually long time—181 months—that the individual has already spent in jail, which is much higher than what is typical in the dataset; extended incarceration can sometimes be associated with lower short-term recidivism, possibly due to age-related desistance or the impact of long-term separation from previous criminal networks.",11.89,9.29,2.6
3,2,"Another key consideration was that the individual has not recidivated before, suggesting a history of compliance after release, which generally lowers risk.",9.7,9.29,0.41
3,3,"The model also took into account that the individual is not recorded as Black, a demographic factor that, while controversial and complex, has been shown in some datasets to correlate with different recidivism rates, often reflecting broader systemic issues.",9.92,9.29,0.64
3,4,"Finally, the relatively young age of 25 and a lower-than-average number of prior crimes (2 compared to the dataset average) were considered, but these factors were less influential than the extended jail time and lack of prior recidivism, ultimately supporting the model’s prediction of a lower risk of reoffending.",12.03,9.29,2.74
4,0,"The model predicted that this individual is not likely to be rearrested within the next two years, despite a history that might suggest otherwise.",11.7,10.0,1.7
4,1,"The most influential factor in the prediction was the high number of prior crimes—26, which is much higher than what is typical in the dataset—usually a strong signal for future recidivism.",11.48,10.0,1.48
4,2,"However, the model also considered that, although this person has recidivated before, their current age of 36 may play a protective role, as research often shows that the likelihood of reoffending tends to decrease as people get older.",12.89,10.0,2.89
4,3,"Additionally, the fact that this individual has not spent any recent time in jail, compared to the average, may indicate a period of stability or successful community integration.",10.94,10.0,0.94
4,4,"While being recorded as Black is a noted feature in the data, the model’s decision was more heavily influenced by the interplay between prior criminal history and current life circumstances, ultimately tipping the balance toward a lower risk prediction.",9.36,10.0,-0.64
5,0,The model predicted that the individual undergoing recidivism risk assessment is likely to be rearrested within two years.,9.36,8.57,0.79
5,1,"Age played the most significant role in this prediction, as the individual is 37 years old—older than the average in the dataset—which typically suggests a lower risk, since recidivism rates often decline with age.",10.68,8.57,2.11
5,2,"However, the fact that this person has not previously recidivated, which would usually be a protective factor, was outweighed by other considerations.",9.24,8.57,0.67
5,3,"Notably, the individual has three prior crimes, which, while slightly below the dataset average, still signals a history of criminal involvement that increases risk, and their relatively short time spent in jail (just two months compared to the average of over 20) may indicate less exposure to rehabilitative programs or consequences.",8.74,8.57,0.17
5,4,"Additionally, the model considered that the individual is not recorded as Black, a factor that, while present in the data, should be interpreted with caution due to broader social and systemic issues; ultimately, the combination of these features led the model to predict a higher likelihood of recidivism despite some factors that might have suggested otherwise.",9.74,8.57,1.17
6,0,The model predicted that this individual is at risk of being rearrested within two years.,10.22,9.27,0.95
6,1,"The most influential factor in this prediction was the person’s young age of 21, which is notably lower than the average and often associated with higher recidivism risk, possibly because younger individuals have more years ahead in which to reoffend and may have less stable life circumstances.",12.71,9.27,3.44
6,2,"Interestingly, the individual has only one prior crime, which is much fewer than the average in the dataset, and this would typically lower the risk, but it was outweighed by other factors.",10.93,9.27,1.67
6,3,"The model also considered that the person has previously recidivated and is recorded as Black, both of which can reflect broader systemic patterns and historical data trends, though it’s important to recognize that these factors may also reflect biases present in the data.",9.19,9.27,-0.07
6,4,"Finally, the very short time spent in jail—just one month compared to a much higher average—may suggest limited exposure to rehabilitative programs or insufficient time for deterrence, which could also contribute to the elevated risk prediction.",9.86,9.27,0.59
7,0,"The model predicted that this individual is at risk of recidivism, even though their age—at 62 years old—is much higher than the typical person assessed, which usually lowers risk since older individuals are statistically less likely to reoffend.",12.75,11.25,1.5
7,1,"Interestingly, despite having no prior crimes, a factor that would generally suggest a lower risk, the model still flagged them as likely to recidivate.",12.08,11.25,0.83
7,2,"The fact that this person is not recorded as Black and has not previously recidivated are both characteristics that, in many datasets, are associated with a reduced risk, yet these did not outweigh other influences in the model’s decision.",11.11,11.25,-0.14
7,3,"Their very short time spent in jail—just one month compared to the average of over 20 months—may have contributed to the prediction, possibly because limited incarceration can sometimes mean less access to rehabilitation programs or less time for deterrence.",11.37,11.25,0.12
7,4,"Overall, the model’s decision seems to be shaped by a complex interplay of factors, and while some features point toward a lower risk, there may be subtle patterns in the data that lead the model to err on the side of caution for this assessment.",13.94,11.25,2.69
8,0,"The model predicted that the individual is at risk of recidivism, meaning it expects they will be rearrested within two years.",9.42,7.66,1.76
8,1,"The most influential factor in this prediction was the individual's age: at 38, they are older than the average person assessed, and while older age is often linked to lower recidivism risk, this effect may have been outweighed by other factors.",10.23,7.66,2.57
8,2,"Notably, the individual has only two prior crimes, which is fewer than the average in the dataset, suggesting a somewhat lower risk, but this protective factor may not have been strong enough on its own.",8.88,7.66,1.23
8,3,"The model also considered that the individual is not recorded as Black and has not previously recidivated, both of which, in the context of the dataset, are associated with a lower risk of reoffending.",8.75,7.66,1.09
8,4,"However, the very short time spent in jail—just one month compared to the much longer average—could indicate that the individual may not have received interventions or deterrents that sometimes accompany longer sentences, possibly tipping the balance toward a higher predicted risk.",7.18,7.66,-0.47
9,0,The model predicted that this individual is at risk of being rearrested within two years.,12.29,10.17,2.12
9,1,"The most influential factor in this prediction was the person’s young age of 21, which is much lower than the average and is often associated with a higher likelihood of recidivism, possibly due to less life stability or experience.",14.3,10.17,4.13
9,2,"Interestingly, despite having no prior crimes—unlike the average person in the dataset who has several—this protective factor was outweighed by other risks.",9.8,10.17,-0.37
9,3,"The individual also has not previously recidivated and has never spent time in jail, both of which typically lower the risk, but these positives were not enough to offset the impact of their youth.",11.37,10.17,1.2
9,4,"Finally, the model noted that the person is not recorded as Black, a demographic factor that, while present in the data, played a smaller role compared to age and prior history, suggesting that the prediction was driven primarily by the individual’s age rather than their criminal or demographic background.",11.14,10.17,0.97
10,0,The model predicted that this individual is at risk of being rearrested within two years.,11.12,9.92,1.2
10,1,"The most influential factor in this assessment was the number of prior crimes, which, at just one, is notably lower than what is typical among others assessed, suggesting a lower baseline risk.",11.59,9.92,1.67
10,2,"However, the fact that this person has not previously recidivated also points toward a more favorable outlook, as those with a history of repeat offenses are generally at higher risk.",12.18,9.92,2.27
10,3,"Demographic factors, such as not being recorded as Black, and being slightly older than average at 36, both tend to be associated with a reduced likelihood of recidivism, according to broader criminal justice research.",11.15,9.92,1.23
10,4,"Despite these protective factors, the model’s prediction may reflect the complex interplay of these features, possibly influenced by the fact that the individual has not spent any time in jail, which can sometimes mean less exposure to rehabilitative programs or supervision that might otherwise lower risk.",10.54,9.92,0.62
11,0,The model predicted that this individual is at risk of being rearrested within two years.,9.5,8.13,1.37
11,1,"The most influential factor in this prediction was the individual’s age: at 42, they are notably older than the average person assessed, and older age is often associated with a lower risk of recidivism, which may have worked in their favor.",11.57,8.13,3.45
11,2,"However, the model also considered the person’s prior criminal history, noting that they have only one prior offense—much fewer than the average—suggesting a relatively limited history of criminal behavior, which typically reduces risk.",9.34,8.13,1.21
11,3,"Despite these protective factors, the model was influenced by the fact that this individual has previously recidivated, a strong signal that can outweigh other positive indicators, as past behavior is one of the best predictors of future actions.",9.16,8.13,1.03
11,4,"Additionally, the time spent in jail and the individual’s recorded race were considered, but these played a smaller role in the final prediction compared to the direct evidence of prior recidivism.",8.17,8.13,0.04
12,0,The model predicted that the individual undergoing recidivism risk assessment is likely to be rearrested within two years.,9.41,8.77,0.64
12,1,"The most influential factor in this prediction was that the individual has not previously recidivated, which would typically lower their risk, but this effect was outweighed by other considerations.",10.37,8.77,1.6
12,2,"Notably, the individual is only 23 years old, which is significantly younger than the average in the dataset, and younger age is often associated with a higher risk of reoffending, possibly due to less life stability or fewer established social supports.",12.14,8.77,3.36
12,3,"Although the person has not spent any time in jail—something that might suggest a lower risk—their record includes two prior crimes, which, while below average, still signals some history of criminal behavior.",8.86,8.77,0.09
12,4,"Finally, the model took into account that the individual is not recorded as Black, a demographic factor that, in this context, did not increase the predicted risk, suggesting that the combination of youth and prior offenses played a more decisive role in the outcome.",9.31,8.77,0.53
13,0,"The model predicted that this individual is at risk of recidivism, meaning it expects they will be rearrested within two years.",7.88,7.11,0.77
13,1,"Interestingly, the most influential factor in this prediction was the number of prior crimes, and in this case, the individual has no prior offenses, which typically would lower the risk compared to the average person in the dataset.",8.46,7.11,1.35
13,2,"However, the model also considered whether the person had previously recidivated, and here again, the answer is no, which would usually suggest a lower risk.",7.9,7.11,0.79
13,3,"Despite these protective factors, the model weighed other aspects, such as the fact that the individual is only 24 years old—significantly younger than the average in the dataset—and younger age is often associated with higher recidivism risk, possibly because younger people have more years ahead in which to reoffend and may have less stable life circumstances.",9.01,7.11,1.89
13,4,"The model also took into account that the individual has not spent any time in jail and is not recorded as Black, but these factors did not outweigh the risk associated with their age, leading to the final prediction.",7.38,7.11,0.26
14,0,The model predicted that this individual is not likely to be rearrested within the next two years.,10.84,9.33,1.51
14,1,"The most influential factor in this decision was the relatively long time—33 months—that the individual has already spent in jail, which is much higher than average and may have provided a strong deterrent or opportunity for rehabilitation.",12.94,9.33,3.62
14,2,"Although the person has a history of recidivism, this negative signal was outweighed by other factors, especially the extended jail time.",9.74,9.33,0.41
14,3,"The individual’s number of prior crimes is actually lower than average, and their age is typical for the population assessed, both of which may suggest a lower risk of reoffending.",10.72,9.33,1.4
14,4,"Finally, while being recorded as Black is a demographic detail included in the model, it played a smaller role compared to the other factors, and the overall combination of features led the model to predict a lower risk of recidivism for this case.",9.92,9.33,0.59
15,0,The model predicted that this individual is at risk of being rearrested within two years.,10.99,10.59,0.39
15,1,"The most influential factor in this prediction was the number of prior crimes, and interestingly, this person has no prior offenses, which typically would lower their risk compared to the average individual in the dataset.",13.31,10.59,2.72
15,2,"However, the model also considered whether the person had previously recidivated, and in this case, they had not, which again would usually suggest a lower risk.",12.37,10.59,1.78
15,3,"The individual is recorded as Black, and while this feature had a negative influence on the prediction in this context, it is important to recognize that such demographic variables can reflect broader systemic patterns rather than individual behavior.",11.06,10.59,0.47
15,4,"Despite having spent only one month in jail and not currently facing a misdemeanor charge—both factors that might be expected to reduce risk—the model still arrived at a prediction of recidivism, possibly due to complex interactions between these features and patterns learned from the data.",10.95,10.59,0.36
16,0,The model predicted that this individual is not likely to be rearrested within the next two years.,13.28,11.09,2.19
16,1,Although they have a notably high number of prior crimes—far above what is typical in the dataset—this risk factor was outweighed by other aspects of their profile.,12.54,11.09,1.45
16,2,"Most significantly, their age of 61 stands out as a strong protective factor, since older individuals are generally less likely to reoffend, possibly due to changes in life circumstances or declining physical ability.",14.94,11.09,3.85
16,3,"The fact that they have not recidivated before and spent only a single month in jail, much less than average, further supports the model’s assessment that they are at low risk.",14.07,11.09,2.98
16,4,"While being recorded as Black is included in the model, its influence was less significant compared to the other features, and the overall combination of age, prior behavior, and brief incarceration led to the favorable prediction.",10.8,11.09,-0.29
17,0,The model predicted that this individual is at risk of being rearrested within two years.,10.85,10.38,0.47
17,1,"The most influential factor in this prediction was the unusually long time—82 months—that the individual has spent in jail, which is much higher than what is typical in the dataset; this extended incarceration may signal a history of more serious or repeated offenses, which can be associated with higher recidivism risk.",15.01,10.38,4.63
17,2,"Age also played a significant role, as the individual is 37 years old, and research often finds that recidivism risk remains relatively high until later adulthood.",11.71,10.38,1.32
17,3,"The model also considered that the individual is not recorded as Black, which, given the dataset’s context, may have slightly reduced the predicted risk, possibly reflecting broader patterns in the data.",10.83,10.38,0.45
17,4,"Interestingly, even though the person has previously recidivated, this feature actually pulled the risk estimate down, perhaps because it interacts with other factors like age or time served in jail, suggesting a more complex relationship.",10.93,10.38,0.54
18,0,The model predicted that this individual is not likely to be rearrested within the next two years.,11.27,9.77,1.5
18,1,"The most influential factor in this decision was the unusually long time—260 months—that the individual has already spent in jail, which is far above what is typical and may suggest a period of stability or rehabilitation that reduces immediate risk.",9.57,9.77,-0.2
18,2,"Although the individual is quite young at 22, which can sometimes be associated with higher recidivism risk, the extended incarceration may have had a stronger impact in shaping the prediction.",10.44,9.77,0.67
18,3,"The model also considered that the person has previously recidivated and is recorded as Black, both of which are factors that, in some contexts, have been linked to higher risk, but in this case, their influence was outweighed by the other features.",11.72,9.77,1.95
18,4,"Finally, the number of prior crimes matches the average, so it did not tip the scales, and overall, the combination of these factors led the model to predict a lower risk of recidivism for this individual.",11.35,9.77,1.58
19,0,"The model predicted that the individual is at risk of recidivism, meaning it expects they will be rearrested within two years.",10.7,8.93,1.76
19,1,"The most influential factor in this prediction is the individual’s age: at 50, they are much older than the typical person assessed, and generally, older age is associated with a lower risk of reoffending, so this actually worked in their favor.",10.69,8.93,1.75
19,2,"However, the model also considered their prior criminal history, noting that they have only one prior crime, which is fewer than average and would typically suggest a lower risk as well.",10.0,8.93,1.06
19,3,"Interestingly, the individual has not recidivated before and is not recorded as Black, both of which are factors that, based on historical data, tend to be associated with a reduced likelihood of future recidivism.",9.98,8.93,1.04
19,4,"Despite these protective factors, the model still predicted a higher risk, possibly because even a single prior offense and a recent, albeit brief, jail stay can weigh heavily in risk assessments, especially when combined with complex patterns in the data that may not be immediately obvious.",8.73,8.93,-0.2
20,0,"The model predicted that this individual is at risk of recidivism, or being rearrested within two years.",9.62,8.5,1.11
20,1,"Interestingly, the person’s age stands out as a major factor: at 54, they are much older than the typical individual in the dataset, and older age is generally associated with a lower risk of reoffending, which should have worked in their favor.",12.0,8.5,3.5
20,2,"However, the model also considered the number of prior crimes, and in this case, the individual has no prior offenses, which again would usually suggest a lower risk.",9.86,8.5,1.35
20,3,"Despite these protective factors, the model’s prediction may have been influenced by subtler patterns, such as the fact that the individual is recorded as Black—a feature that, while less important, can reflect broader systemic biases present in historical data.",8.5,8.5,-0.0
20,4,"Finally, the very short time spent in jail (just one month compared to the average of over 20) might have signaled to the model that there was less opportunity for rehabilitation or intervention, nudging the prediction toward a higher risk despite the otherwise low-risk profile.",9.04,8.5,0.54
21,0,The model predicted that this individual is not likely to be rearrested within the next two years.,9.5,8.27,1.23
21,1,"Although they have a notably high number of prior crimes—much higher than what is typical in the dataset—this risk factor was outweighed by their age, as being 53 years old is significantly older than most others assessed, and older age is often associated with a lower likelihood of reoffending.",9.38,8.27,1.11
21,2,"The model also considered the individual’s recorded race, but this factor played a smaller role compared to their criminal history and age.",9.14,8.27,0.87
21,3,"Interestingly, the fact that the person has not recidivated before and is currently facing a misdemeanor charge, rather than a more serious offense, further supported the prediction of a lower risk.",9.47,8.27,1.2
21,4,"Altogether, while a long history of prior offenses might usually raise concern, the combination of advanced age, lack of recent recidivism, and the less severe nature of the current charge led the model to predict a low risk of recidivism for this individual.",10.65,8.27,2.38
22,0,The model predicted that this individual is not likely to be rearrested within the next two years.,11.77,10.34,1.42
22,1,"The most influential factor in this decision was the relatively low number of prior crimes—just one—compared to the typical person assessed, which strongly signaled a lower risk.",11.29,10.34,0.95
