text_id,sentence_index,removed_sentence,ppl_without_sentence,original_ppl,ppl_change
22,2,"Although the individual is quite young at 23, an age often associated with higher recidivism risk, this was outweighed by their limited criminal history.",12.11,10.34,1.77
22,3,"The model also considered that the person has previously recidivated and is recorded as Black, both factors that, in the context of broader criminal justice data, can be associated with higher risk, but these were not enough to tip the prediction.",10.75,10.34,0.4
22,4,"Finally, the short time spent in jail—only three months, much less than average—may suggest a less severe criminal background, further supporting the model’s assessment of low recidivism risk.",11.51,10.34,1.16
23,0,The model predicted that this individual is not likely to be rearrested within the next two years.,10.76,9.42,1.34
23,1,"The most influential factor in this assessment was the person’s age: at just 20 years old, their youth would typically be associated with a higher risk, but other aspects of their history counterbalanced this.",10.6,9.42,1.18
23,2,"Notably, the individual has no prior criminal offenses, which stands out against the average in the dataset and strongly suggests a lower risk of recidivism, as a clean record is one of the most reliable indicators of future behavior.",11.21,9.42,1.78
23,3,"Although the person has previously recidivated, the absence of any time spent in jail and the fact that they are not recorded as Black—an attribute that, due to systemic biases in the data, can sometimes influence risk assessments—both contributed to the model’s more optimistic outlook.",9.48,9.42,0.05
23,4,"Taken together, these features paint a picture of someone who, despite their young age and a prior recidivism event, has a background that the model associates with a lower likelihood of reoffending, especially given the lack of prior crimes and jail time.",11.41,9.42,1.99
24,0,The model predicted that this individual is at risk of being rearrested within two years.,13.17,12.16,1.01
24,1,"Interestingly, despite having no prior crimes—a factor that usually lowers risk compared to the average person in the dataset—the prediction was still for recidivism, suggesting other features played a significant role.",13.85,12.16,1.69
24,2,"The individual is not recorded as Black and has not recidivated before, both of which, based on historical data, are typically associated with a lower risk, yet these protective factors were outweighed.",12.37,12.16,0.21
24,3,"Notably, the person spent only one month in jail, much less than the average, which might indicate a less severe offense or a quicker release, but this alone did not offset the overall risk.",15.07,12.16,2.91
24,4,"The current charge being a misdemeanor, which is generally less serious, may have contributed to a slightly lower risk, but the model’s decision suggests that even with these seemingly positive factors, other patterns in the data led to a prediction of recidivism—perhaps reflecting broader trends where even individuals with minimal criminal history can still face significant risk due to complex, less obvious factors.",14.38,12.16,2.22
25,0,The model predicted that this individual is not likely to be rearrested within the next two years.,9.46,8.8,0.66
25,1,"The most influential factor in this decision was the person’s age: at 25, they are notably younger than the average in the dataset, and younger age is often associated with a higher risk of recidivism, so this would have pushed the risk higher.",12.26,8.8,3.46
25,2,"However, the model also considered whether the individual is recorded as Black, and in this case, they are not, which, based on patterns in the data, slightly reduced the estimated risk.",9.83,8.8,1.04
25,3,"Interestingly, despite having a history of recidivism and five prior crimes—both of which would typically increase risk—the model weighed these against the fact that the individual spent only a single month in jail, much less than average, which may suggest a less severe criminal history or more favorable circumstances.",9.65,8.8,0.85
25,4,"Altogether, while some factors pointed toward higher risk, the combination of demographic details and relatively short jail time led the model to predict a lower likelihood of recidivism for this person.",10.05,8.8,1.25
26,0,"The model predicted that this individual is at risk of recidivism, meaning they are likely to be rearrested within two years.",10.84,8.74,2.1
26,1,"Interestingly, the most influential factor in this prediction was the number of prior crimes, and in this case, the individual had no prior offenses, which typically would lower the risk.",10.71,8.74,1.97
26,2,"However, the model also considered that the person has not recidivated before, which again would usually suggest a lower risk, but these protective factors were outweighed by other considerations.",9.34,8.74,0.59
26,3,"The individual’s young age of 24 played a significant role, as younger people are statistically more likely to reoffend, possibly due to factors like less stable life circumstances or peer influences.",9.94,8.74,1.2
26,4,"Although the person is not recorded as Black and has only spent a short time in jail compared to the average, the combination of youth and other subtle patterns in the data led the model to predict a higher risk, highlighting how complex and sometimes counterintuitive these assessments can be.",8.13,8.74,-0.62
27,0,The model predicted that this individual is not likely to be rearrested within the next two years.,9.7,9.16,0.54
27,1,"The most influential factor in this assessment was the relatively low number of prior crimes—just one—compared to the typical person in the dataset, who has committed several more, which generally signals a lower risk of reoffending.",10.6,9.16,1.44
27,2,"Although the individual has recidivated before, this risk factor was outweighed by other positive indicators, such as having spent slightly less time in jail than average, which may suggest less exposure to environments that can reinforce criminal behavior.",9.7,9.16,0.55
27,3,"The model also considered that the individual is not recorded as Black, a demographic detail that, while controversial, has been shown in some datasets to correlate with different recidivism rates due to systemic factors.",9.08,9.16,-0.08
27,4,"Finally, being 26 years old, somewhat younger than the average in the dataset, may have had a modest effect, as younger age can sometimes be associated with higher risk, but in this case, it was not enough to tip the prediction toward recidivism.",11.18,9.16,2.02
28,0,The model predicted that this individual is not likely to be rearrested within the next two years.,11.91,10.88,1.03
28,1,"The most influential factor in this assessment was the person’s history of prior crimes: with seven previous offenses, which is higher than average, this would typically increase the risk, but other factors helped offset this.",11.7,10.88,0.82
28,2,"Notably, the individual is not recorded as Black, and while race should not determine outcomes, in many criminal justice datasets, being identified as Black has historically correlated with higher predicted risk, possibly reflecting broader systemic biases.",10.55,10.88,-0.33
28,3,"Although the person has recidivated before, their relatively young age of 29—compared to the average age in the dataset—may suggest a greater potential for change or rehabilitation, as younger individuals sometimes respond better to interventions.",12.79,10.88,1.91
28,4,"Finally, the current charge being a misdemeanor, rather than a more serious offense, likely reassured the model that the risk of future serious criminal behavior is lower, contributing to the overall prediction of a low risk of recidivism.",13.44,10.88,2.55
29,0,The model predicted that this individual is not likely to be rearrested within the next two years.,11.62,10.56,1.06
29,1,"The most influential factor in this decision was the person’s history of prior crimes: with 12 previous offenses—much higher than the typical average—this would usually increase the risk, but other aspects of their profile shifted the prediction.",10.36,10.56,-0.2
29,2,"Notably, the individual has not spent any time in jail recently, which may suggest a period of stability or successful community supervision, counterbalancing the risk from their criminal history.",12.99,10.56,2.43
29,3,"Although the person has recidivated before and is identified as Black—both factors that, in the context of the data, are associated with higher risk—their relatively young age of 29, compared to the average, may indicate a turning point where the likelihood of further offenses begins to decline.",12.38,10.56,1.82
29,4,"Taken together, the model appears to weigh the absence of recent jail time and the individual’s age as signs of positive change, ultimately leading to a prediction of low recidivism risk despite a challenging background.",11.97,10.56,1.41
